id	author	text	raw_text	likes	published_at	updated_at	num_replies
UgwudKOW0wSVtUwtjcN4AaABAg	#サイ	黄色の衣装でみんなが映えてて目が幸せ^ ^	黄色の衣装でみんなが映えてて目が幸せ^ ^	0	2019-09-12T03:54:13.000Z	2019-09-12T03:54:13.000Z	0
UgzjPIrCF85RXNyF5BV4AaABAg	kazuya賀津也	チャンネル登録してね	チャンネル登録してね	0	2019-09-12T03:53:52.000Z	2019-09-12T03:53:52.000Z	0
UgxcVEorVOmCjk7lpwF4AaABAg	ヤジくぬぎ	ひなの推し	ひなの推し	1	2019-09-12T03:53:44.000Z	2019-09-12T03:53:44.000Z	0
UgxI3xoS18EJSLJQzzJ4AaABAg	kazuya賀津也	チャンネル登録してね	チャンネル登録してね	0	2019-09-12T03:53:41.000Z	2019-09-12T03:53:41.000Z	1
UgxI3xoS18EJSLJQzzJ4AaABAg.8zlVTvBiBYa8zlVfd5OJ53	M H	きも	きも	0	2019-09-12T03:55:24.000Z	2019-09-12T03:55:24.000Z	0
UgxOnhthbPJytQKnkox4AaABAg	Shin-Shin	日向坂46らしい曲って感じ！<br />良かったんじゃない？今日もみんな、良いね！	"日向坂46らしい曲って感じ！
良かったんじゃない？今日もみんな、良いね！"	0	2019-09-12T03:53:40.000Z	2019-09-12T03:53:40.000Z	0
UgwS50OIjJne2OayTUR4AaABAg	あいどるヲタク	きょんこの髪の毛になりたい	きょんこの髪の毛になりたい	0	2019-09-12T03:53:36.000Z	2019-09-12T03:53:36.000Z	0
UgxPOPw93oIVDezcHGZ4AaABAg	kazuya賀津也	チャンネル登録してね	チャンネル登録してね	0	2019-09-12T03:53:34.000Z	2019-09-12T03:53:34.000Z	0
UgxfEMHqCtyCvRWI5yl4AaABAg	kazuya賀津也	日向阪46最高！！！	日向阪46最高！！！	0	2019-09-12T03:53:15.000Z	2019-09-12T03:53:15.000Z	0
Ugz0WnJmVEdtaoWJjtV4AaABAg	欅太郎	この衣装はなんだろうか？ 可愛い😍	この衣装はなんだろうか？ 可愛い😍	1	2019-09-12T03:53:14.000Z	2019-09-12T03:53:14.000Z	0
UgxZil_KIKA3BmkzkTp4AaABAg	モウリーニョ龍成	1週間後<br /><br /><br /><br />shootverに変更のお知らせ	"1週間後



shootverに変更のお知らせ"	1	2019-09-12T03:53:09.000Z	2019-09-12T03:53:09.000Z	0
Ugwbyhi3O86y0gO72al4AaABAg	おおはし	こさかなってどの曲でも似合うからすごい。みんな似合うけど。「もしこの子がセンターなら、こんな曲かな？」って考えるのが楽しい。	こさかなってどの曲でも似合うからすごい。みんな似合うけど。「もしこの子がセンターなら、こんな曲かな？」って考えるのが楽しい。	0	2019-09-12T03:52:46.000Z	2019-09-12T03:52:46.000Z	0
UgwliRodC5IvVpVPneV4AaABAg	日向ぼっこ	男の子だけど、おひさまだよーって人いますか？	男の子だけど、おひさまだよーって人いますか？	5	2019-09-12T03:52:32.000Z	2019-09-12T03:52:32.000Z	0
Ugznl7Uxo3Isx0NuNZ14AaABAg	ゴン	"おい、小坂推しのみんな<br /><a href=""https://www.youtube.com/watch?v=3ZR2_TK2lV0&amp;t=1m17s"">1:17</a><br />この顔好きでしょ？"	"おい、小坂推しのみんな
1:17
この顔好きでしょ？"	0	2019-09-12T03:52:27.000Z	2019-09-12T03:52:27.000Z	0
Ugwd1etuEizE6KBlAOt4AaABAg	つよぽん	日向はみんなまんべんなくかわいく映ってるからいいよね	日向はみんなまんべんなくかわいく映ってるからいいよね	1	2019-09-12T03:52:24.000Z	2019-09-12T03:52:24.000Z	0
Ugy_os6lq1bXhK09PR54AaABAg	太田シェル	ふーーーん<br /><br /><br /><br /><br /><br /><br /><br /><br />素敵じゃない	"ふーーーん








素敵じゃない"	1	2019-09-12T03:52:18.000Z	2019-09-12T03:52:18.000Z	0
UgwlOIFVyVWcQ3Af64N4AaABAg	kazuya賀津也	可愛い	可愛い	0	2019-09-12T03:52:16.000Z	2019-09-12T03:52:16.000Z	0
UgzYkcV6kHVoRtnZLCV4AaABAg	小特特	なおちゃん好きだ	なおちゃん好きだ	0	2019-09-12T03:52:11.000Z	2019-09-12T03:52:11.000Z	0
UgwTcw-Y6MEFvLCQGut4AaABAg	kazuya賀津也	可愛い	可愛い	0	2019-09-12T03:52:10.000Z	2019-09-12T03:52:10.000Z	0
UgwLD4f4IuFwQ_34jDx4AaABAg	kazuya賀津也	可愛い	可愛い	0	2019-09-12T03:51:58.000Z	2019-09-12T03:51:58.000Z	0
UgwlXjjv59aAkHyoAV54AaABAg	黒髪のかず	この曲3枚目で1番ええぞー	この曲3枚目で1番ええぞー	1	2019-09-12T03:51:42.000Z	2019-09-12T03:51:42.000Z	0
UgwoGkYzrfdIwQNhqEZ4AaABAg	り〜ふ	まって、可愛さカンストしてる辛い	まって、可愛さカンストしてる辛い	1	2019-09-12T03:51:35.000Z	2019-09-12T03:51:35.000Z	0
Ugzdvv2Ym9emH1V_FFR4AaABAg	ムフ液体	日向の曲ってコーヒーのCMに起用できそうなの多いよね	日向の曲ってコーヒーのCMに起用できそうなの多いよね	1	2019-09-12T03:51:28.000Z	2019-09-12T03:51:28.000Z	0
UgytZxpDByQSLEFcF0Z4AaABAg	kazuya賀津也	きたーーーー！マナフィ可愛い	きたーーーー！マナフィ可愛い	2	2019-09-12T03:51:28.000Z	2019-09-12T03:51:28.000Z	0
Ugz0k7_IFmvHiYxJODZ4AaABAg	まい まい	好花ちゃんの表情いつ見てもたのしそうで幸せ(՞ o̴̶̷̤  ̫o̴̶̷̤ ՞)	好花ちゃんの表情いつ見てもたのしそうで幸せ(՞ o̴̶̷̤  ̫o̴̶̷̤ ՞)	1	2019-09-12T03:51:13.000Z	2019-09-12T03:51:13.000Z	0
UgxtwY41wpvNFVf6ldl4AaABAg	流しそうめん	"<a href=""https://www.youtube.com/watch?v=3ZR2_TK2lV0&amp;t=2m28s"">2:28</a><br />水玉ピンクでみたことあるような"	"2:28
水玉ピンクでみたことあるような"	1	2019-09-12T03:51:11.000Z	2019-09-12T03:51:11.000Z	0
Ugx6gb9FF91TbZTVczh4AaABAg	ぶうぱち	にぶちゃんツインテめっちゃ可愛い！！！！！！	にぶちゃんツインテめっちゃ可愛い！！！！！！	0	2019-09-12T03:50:55.000Z	2019-09-12T03:50:55.000Z	0
Ugx1LIxyxRU5Yugc0Qt4AaABAg	kazuya賀津也	最高♥	最高♥	0	2019-09-12T03:50:49.000Z	2019-09-12T03:50:49.000Z	0
UgyIz0LfJ6AvYKArN754AaABAg	ジダン	振り付けが100点満点！！	振り付けが100点満点！！	1	2019-09-12T03:50:47.000Z	2019-09-12T03:50:47.000Z	0
Ugwl0PsNQ_NCkqcE5sN4AaABAg	nandeyan	"<a href=""https://www.youtube.com/watch?v=3ZR2_TK2lV0&amp;t=4m04s"">4:04</a>のミホワタナベの最強笑顔"	4:04のミホワタナベの最強笑顔	0	2019-09-12T03:50:46.000Z	2019-09-12T03:50:46.000Z	0
UgyLy7igdriL9Rrr5IR4AaABAg	ブルーマウンテン	9/16に握手会初めて行くんですけど握手する時みなさんどんなこと言ってるんですか？？？	9/16に握手会初めて行くんですけど握手する時みなさんどんなこと言ってるんですか？？？	0	2019-09-12T03:50:44.000Z	2019-09-12T03:50:44.000Z	0
Ugy9oz_JUJhJf6p7DTt4AaABAg	kazuya賀津也	日向阪の子可愛い子たちいる！<br />うちの職場の子たち可愛い	"日向阪の子可愛い子たちいる！
うちの職場の子たち可愛い"	0	2019-09-12T03:50:31.000Z	2019-09-12T03:50:31.000Z	0
UgwLIU4r1O2DrV_algp4AaABAg	哀よし	めっちゃすし！🍣<br />爽やかすぎる	"めっちゃすし！🍣
爽やかすぎる"	4	2019-09-12T03:50:31.000Z	2019-09-12T03:50:31.000Z	0
UgyU5BIlxfR5jV2jd3x4AaABAg	にゃん にゃん	あゃめぃちゃん達の髪型が最高…！！	あゃめぃちゃん達の髪型が最高…！！	0	2019-09-12T03:50:29.000Z	2019-09-12T03:50:29.000Z	0
UgzW-jxEn533ezcsXwd4AaABAg	Spring Snow	きょんこのハーフツインは神!!🥰<br />あ、お団子もポニテも好きだよ😇	"きょんこのハーフツインは神!!🥰
あ、お団子もポニテも好きだよ😇"	0	2019-09-12T03:50:25.000Z	2019-09-12T03:50:25.000Z	0
UgyH7_0asKkksxP0vNh4AaABAg	ねい__	幕張メッセきたあああ(笑)	幕張メッセきたあああ(笑)	0	2019-09-12T03:50:19.000Z	2019-09-12T03:50:19.000Z	0
UgyMaEo2x0nvM8ATj6F4AaABAg	暑い寒い	めちゃくちゃ幕張メッセやん	めちゃくちゃ幕張メッセやん	0	2019-09-12T03:50:13.000Z	2019-09-12T03:50:13.000Z	0
UgyJl5wDGSH-oY80VPF4AaABAg	らりるれろんげろんげ:	低評価押したの全部現国の先生説濃厚	低評価押したの全部現国の先生説濃厚	16	2019-09-12T03:50:05.000Z	2019-09-12T03:50:05.000Z	1
UgyJl5wDGSH-oY80VPF4AaABAg.8zlV3ZFNJeR8zlfPEvUYlI	ああ	お前のコメントはもっと評価されるべき	お前のコメントはもっと評価されるべき	1	2019-09-12T05:29:09.000Z	2019-09-12T05:29:09.000Z	0
Ugzii9KX2i97tRSl2Lh4AaABAg	日向坂46をもっと広め隊 隊長	えっ JOYFUL LOVE並の神曲久々にきたんじゃね？？	えっ JOYFUL LOVE並の神曲久々にきたんじゃね？？	5	2019-09-12T03:49:39.000Z	2019-09-12T03:49:39.000Z	0
UgxHZJaAhMhfOHQqnl94AaABAg	五十嵐翔太朗	"<a href=""https://www.youtube.com/watch?v=3ZR2_TK2lV0&amp;t=3m50s"">3:50</a>   俺用。"	3:50   俺用。	0	2019-09-12T03:49:34.000Z	2019-09-12T03:49:34.000Z	0
UgwOYKlERhzU1UpCEPB4AaABAg	kazuya賀津也	sony Musicentertainmentありがとうございます	sony Musicentertainmentありがとうございます	0	2019-09-12T03:49:34.000Z	2019-09-12T03:49:34.000Z	0
Ugxe5y2n5nfX0gc0kbN4AaABAg	のんシュガー	井口頑張れ！	井口頑張れ！	1	2019-09-12T03:49:32.000Z	2019-09-12T03:49:32.000Z	0
UgzEcys5tShP0Xv1hbp4AaABAg	kazuya賀津也	sony Musicentertainmentありがとうございます。<br />こんな子たちをマネジメントをしてくれて	"sony Musicentertainmentありがとうございます。
こんな子たちをマネジメントをしてくれて"	0	2019-09-12T03:49:25.000Z	2019-09-12T03:49:25.000Z	0
UgzSOWaWBDY_mrnkzLR4AaABAg	シロクマさん	いやかわいいがすぎる<br />癒しでしかない	"いやかわいいがすぎる
癒しでしかない"	0	2019-09-12T03:49:15.000Z	2019-09-12T03:49:15.000Z	0
UgySJpG84VX5Aj00TcZ4AaABAg	ナルセロ	小坂菜緒可愛い	小坂菜緒可愛い	1	2019-09-12T03:49:15.000Z	2019-09-12T03:49:15.000Z	0
Ugy7Sqrw3ztI2zGGrN14AaABAg	藤吉夏鈴	一生日向お寿司かねぇので！！😁	一生日向お寿司かねぇので！！😁	3	2019-09-12T03:49:13.000Z	2019-09-12T03:49:13.000Z	0
UgwiEqJsqKM6o6euwiV4AaABAg	kazuya賀津也	sony Musicentertainmentありがとう	sony Musicentertainmentありがとう	0	2019-09-12T03:49:00.000Z	2019-09-12T03:49:00.000Z	0
UgzpGQaBlbA7zFbVLC54AaABAg	kazuya賀津也	sony Musicentertainmentありがとう	sony Musicentertainmentありがとう	0	2019-09-12T03:48:55.000Z	2019-09-12T03:48:55.000Z	0
UgwXhjZLge6EGSXhH_F4AaABAg	kazuya賀津也	sony Musicentertainmentありがとう	sony Musicentertainmentありがとう	0	2019-09-12T03:48:49.000Z	2019-09-12T03:48:49.000Z	0
Ugy3DtJXdBuSosBYX0N4AaABAg	秋口高野	何時に行けばこんな人いない風景が見れるん？？	何時に行けばこんな人いない風景が見れるん？？	0	2019-09-12T03:48:46.000Z	2019-09-12T03:48:46.000Z	0
UgyiYo3GF4X_oa1J8-V4AaABAg	犬よりの猫	<b>みんな可愛い</b>	*みんな可愛い*	0	2019-09-12T03:48:44.000Z	2019-09-12T03:48:44.000Z	0
UgzoUpKLGcC4ismRcs94AaABAg	AOTO. M	なんか5才児混じってんなあ	なんか5才児混じってんなあ	0	2019-09-12T03:48:41.000Z	2019-09-12T03:48:41.000Z	0
UgxPBTIpEVsJfFcxlpJ4AaABAg	kazuya賀津也	めちゃめちゃ可愛い❤	めちゃめちゃ可愛い❤	0	2019-09-12T03:48:41.000Z	2019-09-12T03:48:41.000Z	0
UgwFY2Ofmo-tlZ4Xm914AaABAg	devis miles	紗理菜ちゃんがたくさん！ありがとうございます！	紗理菜ちゃんがたくさん！ありがとうございます！	0	2019-09-12T03:48:27.000Z	2019-09-12T03:48:27.000Z	0
Ugy-70ahfe_GQHblCTx4AaABAg	10000 gsr	"<a href=""https://www.youtube.com/watch?v=3ZR2_TK2lV0&amp;t=3m50s"">3:50</a><br />自分用"	"3:50
自分用"	0	2019-09-12T03:48:13.000Z	2019-09-12T03:48:13.000Z	0
UgyBnMV8rSaCeHL8wa94AaABAg	kazuya賀津也	千葉駅です。とある<br />みんな、どこのロケーションだと思う？	"千葉駅です。とある
みんな、どこのロケーションだと思う？"	0	2019-09-12T03:48:09.000Z	2019-09-12T03:48:09.000Z	0
Ugxf6MTdq_l9xTibdgd4AaABAg	堂安律	皆さん可愛いですね。	皆さん可愛いですね。	0	2019-09-12T03:47:51.000Z	2019-09-12T03:47:51.000Z	0
UgxG51KjrBeJ6g2E_o54AaABAg	やんばる	16日聖地巡礼します	16日聖地巡礼します	0	2019-09-12T03:47:48.000Z	2019-09-12T03:47:48.000Z	0
Ugwj0hMDBn0Kt7hKbFh4AaABAg	46 yuuuki	落ち着いた雰囲気の曲、これライブで聴いたら鳥肌モノですね…<br /><br />当選しなかったけど()	"落ち着いた雰囲気の曲、これライブで聴いたら鳥肌モノですね…

当選しなかったけど()"	0	2019-09-12T03:47:46.000Z	2019-09-12T03:47:46.000Z	0
UgxZb2mZAY6rpeKiwBN4AaABAg	ルンルン	この衣装、芽実絶対似合うやん	この衣装、芽実絶対似合うやん	1	2019-09-12T03:47:45.000Z	2019-09-12T03:47:45.000Z	0
Ugxw205Oaj0n6CSOPTd4AaABAg	kazuya賀津也	千葉だーーーロケーション	千葉だーーーロケーション	0	2019-09-12T03:47:40.000Z	2019-09-12T03:47:40.000Z	0
UgzNDRtnef8Fys9uy0x4AaABAg	kazuya賀津也	千葉県にある。駅だ	千葉県にある。駅だ	0	2019-09-12T03:47:29.000Z	2019-09-12T03:47:29.000Z	0
Ugy27PsvhSdS5L7FCIx4AaABAg	みつきんぐ	ｶﾜ(・∀・)ｲｲ!!	ｶﾜ(・∀・)ｲｲ!!	0	2019-09-12T03:47:11.000Z	2019-09-12T03:47:11.000Z	0
UgyryjOgWh8N9D4-kgx4AaABAg	真田昌幸	井口は本当に必死でやってる感じを出すのが上手いね。別に井口はそういうキャラだから、いいのかもしれないけど、なんか全体のバランスが悪くみえるからあんまり出しゃばらないでほしい。下手だから可愛いっていうのは向いてないと思う。	井口は本当に必死でやってる感じを出すのが上手いね。別に井口はそういうキャラだから、いいのかもしれないけど、なんか全体のバランスが悪くみえるからあんまり出しゃばらないでほしい。下手だから可愛いっていうのは向いてないと思う。	1	2019-09-12T03:47:10.000Z	2019-09-12T03:47:10.000Z	1
UgyryjOgWh8N9D4-kgx4AaABAg.8zlUjHk1Q2Y8zlUqrKe0BS	M H	辛辣やなぁ	辛辣やなぁ	0	2019-09-12T03:48:12.000Z	2019-09-12T03:48:12.000Z	0
Ugx2_bqniMkgjGO-uX14AaABAg	かんけいしょう	振り付けに水玉ピンクあるよな	振り付けに水玉ピンクあるよな	0	2019-09-12T03:47:05.000Z	2019-09-12T03:47:05.000Z	0
UgyHHuglpLCTnDiwv1F4AaABAg	ポエングアームチェア	ささく口笛うま！<br />UVERの7th triggerの口笛できそう	"ささく口笛うま！
UVERの7th triggerの口笛できそう"	0	2019-09-12T03:47:00.000Z	2019-09-12T03:47:00.000Z	0
UgzlpX3WJQH0HbUQHlp4AaABAg	浅井亮介	どのMVも松田さん映ってるとこで一時停止してたけど<br />もう必要ないくらい映ってて泣きそう	"どのMVも松田さん映ってるとこで一時停止してたけど
もう必要ないくらい映ってて泣きそう"	1	2019-09-12T03:47:00.000Z	2019-09-12T03:47:00.000Z	0
UgyuMxtIqSYCRNNUthh4AaABAg	あんちゃ	"<a href=""https://www.youtube.com/watch?v=3ZR2_TK2lV0&amp;t=1m36s"">1:36</a>のやんちゃるダッシュ可愛すぎ"	1:36のやんちゃるダッシュ可愛すぎ	0	2019-09-12T03:46:51.000Z	2019-09-12T03:46:51.000Z	0
Ugx2KRrl5UYyeNbdf8h4AaABAg	カリーパン	塾で現国教えてるけど生徒は長く感じてるのか…。何かごめんなさい。	塾で現国教えてるけど生徒は長く感じてるのか…。何かごめんなさい。	0	2019-09-12T03:46:47.000Z	2019-09-12T03:46:47.000Z	0
Ugxx_KZXDRhmCGU8LzR4AaABAg	CP K	やっぱり日向坂には<br />明るい表情で明るい曲を歌って欲しい、、、！	"やっぱり日向坂には
明るい表情で明るい曲を歌って欲しい、、、！"	1	2019-09-12T03:46:42.000Z	2019-09-12T03:46:42.000Z	0
UgwHIdUMM5RzI6eXFcR4AaABAg	kazuya賀津也	日向阪大好き	日向阪大好き	0	2019-09-12T03:46:34.000Z	2019-09-12T03:46:34.000Z	0
UgwEH8jNa0AN81eVhWR4AaABAg	世界日常	一度に現メンバーが全員歌っているシーン  良い！！	一度に現メンバーが全員歌っているシーン  良い！！	2	2019-09-12T03:46:29.000Z	2019-09-12T03:46:29.000Z	0
UgyYKLTTsN3nisukEd54AaABAg	kazuya賀津也	きたーーー	きたーーー	0	2019-09-12T03:46:17.000Z	2019-09-12T03:46:17.000Z	0
Ugz0xoiXR6b5Hi50urJ4AaABAg	kazuya賀津也	きたーーー	きたーーー	0	2019-09-12T03:46:14.000Z	2019-09-12T03:46:14.000Z	0
UgxinTADtMFEC4rF-vB4AaABAg	kazuya賀津也	きたーーー	きたーーー	0	2019-09-12T03:46:07.000Z	2019-09-12T03:46:07.000Z	0
Ugyan57hFfbNadVzTLN4AaABAg	伊波部武郎	イントロとかサマーウォーズっぽいな！	イントロとかサマーウォーズっぽいな！	1	2019-09-12T03:46:04.000Z	2019-09-12T03:46:04.000Z	0
UgxsLc3obB0agS3xq8F4AaABAg	月足天音!	ガンバレ日本強いぞ日本の音程がw	ガンバレ日本強いぞ日本の音程がw	0	2019-09-12T03:45:54.000Z	2019-09-12T03:45:54.000Z	0
UgxKsKW4iQB9PIsGWxh4AaABAg	ににたま	まなふぃかわいいかわいいかわいい	まなふぃかわいいかわいいかわいい	1	2019-09-12T03:45:36.000Z	2019-09-12T03:45:36.000Z	0
Ugw_URVZ6vzfxo7j5354AaABAg	Clozer Chung	べみほ＜3！！！！！！	べみほ＜3！！！！！！	0	2019-09-12T03:45:30.000Z	2019-09-12T03:45:30.000Z	0
Ugxi37S7kxAa3LSshpZ4AaABAg	Aly Gojal	いい笑顔だ！<br /><br />こっちも笑顔になる	"いい笑顔だ！

こっちも笑顔になる"	1	2019-09-12T03:45:16.000Z	2019-09-12T03:45:16.000Z	0
UgxXZrgrzAtSKuZVaXl4AaABAg	しんゆう	"<a href=""https://www.youtube.com/watch?v=3ZR2_TK2lV0&amp;t=4m32s"">4:32</a> 心から楽しんでる感最高…<br />その後の振りも好き"	"4:32 心から楽しんでる感最高…
その後の振りも好き"	0	2019-09-12T03:45:13.000Z	2019-09-12T03:45:13.000Z	0
UgzLV3TtCHF8lgecTQx4AaABAg	みっかん	これライブでお決まりの曲なりそうやな	これライブでお決まりの曲なりそうやな	0	2019-09-12T03:45:08.000Z	2019-09-12T03:45:08.000Z	0
UgxhsaEoCLEm3qQdMqB4AaABAg	Djdudu Did	べミホの髪型すごい好き！	べミホの髪型すごい好き！	3	2019-09-12T03:45:06.000Z	2019-09-12T03:45:06.000Z	0
UgwzPuo1gwhPkuACj0t4AaABAg	雲のジュウザ	"こんなこと言うとさ『裏を言うんじゃぁ～ないよ！』って言われるかもしれないんだけどね<br />この振り付けならさ、井口も上手に踊れると思うんだよね～<br />（井口はよ帰ってこい！）<br /><br />※おひさまにオススメ動画（主と私は関係ありませんｗ）<br />若林「〜って言われるかもしれないけどさ」集①<br /><a href=""https://www.youtube.com/watch?v=Hl-ciQCv0sA"">https://www.youtube.com/watch?v=Hl-ciQCv0sA</a>"	"こんなこと言うとさ『裏を言うんじゃぁ～ないよ！』って言われるかもしれないんだけどね
この振り付けならさ、井口も上手に踊れると思うんだよね～
（井口はよ帰ってこい！）

※おひさまにオススメ動画（主と私は関係ありませんｗ）
若林「〜って言われるかもしれないけどさ」集①
https://www.youtube.com/watch?v=Hl-ciQCv0sA"	4	2019-09-12T03:44:52.000Z	2019-09-12T03:46:54.000Z	1
UgwzPuo1gwhPkuACj0t4AaABAg.8zlUTPm1HYO8zlV2DhKBx3	M H	裏を言うんじゃぁないよ〜！	裏を言うんじゃぁないよ〜！	0	2019-09-12T03:49:53.000Z	2019-09-12T03:49:53.000Z	0
UgwfcZkJapqnsT1z9RF4AaABAg	Chou Chan	井口が頑張ってる！！<br />応援してるぞ	"井口が頑張ってる！！
応援してるぞ"	0	2019-09-12T03:44:48.000Z	2019-09-12T03:44:48.000Z	0
UgyENs36gbBStyWwCPx4AaABAg	黒ニンニク大魔王	幕張メッセよく使われるな撮影で	幕張メッセよく使われるな撮影で	0	2019-09-12T03:44:47.000Z	2019-09-12T03:44:47.000Z	0
UgyBo1YAghVoDY1GSYh4AaABAg	tantan20080	Very Good.	Very Good.	0	2019-09-12T03:44:40.000Z	2019-09-12T03:44:40.000Z	0
UgwhmdDxEWHzC9vDF3V4AaABAg	かなやわ	めいめい最強説浮上	めいめい最強説浮上	0	2019-09-12T03:44:00.000Z	2019-09-12T03:44:00.000Z	0
UgxQtpSYa_tIMxp_apl4AaABAg	アセント/ascent	全員のカット割りいれてくれるの神	全員のカット割りいれてくれるの神	9	2019-09-12T03:43:33.000Z	2019-09-12T03:43:33.000Z	0
UgybXnMI8Sz_OfB0J154AaABAg	ピクルス。	欅みたいに、いつかは選抜制になるんじゃないかと怯えてる<br />このメンバーでのパフォーマンス以外は想像したくない	"欅みたいに、いつかは選抜制になるんじゃないかと怯えてる
このメンバーでのパフォーマンス以外は想像したくない"	0	2019-09-12T03:43:28.000Z	2019-09-12T03:43:28.000Z	0
UgyC_Ibt141_Jf-z_-l4AaABAg	猫の瞬き	みんな笑顔ですごくイイネ！<br />こっちまでハッピーになる！	"みんな笑顔ですごくイイネ！
こっちまでハッピーになる！"	1	2019-09-12T03:43:13.000Z	2019-09-12T03:43:13.000Z	0
Ugx3tTRoVa5W6UZQ49V4AaABAg	スニーカー兄貴	みんな輝いている<br /><br /><br /><br /><br />愛萌が1番だけど	"みんな輝いている




愛萌が1番だけど"	0	2019-09-12T03:43:09.000Z	2019-09-12T03:43:09.000Z	0
Ugyfx7FfHM4Gai7G5Lx4AaABAg	しばたー	MVの撮影地は我らが幕張だ！！<br /><br />来週の全握は幕張だ！！<br /><br />全握行く人いいね👍<br /><br />by 世界のkawada	"MVの撮影地は我らが幕張だ！！

来週の全握は幕張だ！！

全握行く人いいね👍

by 世界のkawada"	0	2019-09-12T03:43:04.000Z	2019-09-12T03:43:04.000Z	0
Ugx2ylwW2HuEoFTzGPl4AaABAg	kiyo nishi	日向坂の曲全部好き	日向坂の曲全部好き	0	2019-09-12T03:43:02.000Z	2019-09-12T03:43:02.000Z	0
Ugx4XL-C-8bS3sHWSM14AaABAg	lwoavseio	金村美玖さんだいすきいいいいいいいいいいい	金村美玖さんだいすきいいいいいいいいいいい	0	2019-09-12T03:42:56.000Z	2019-09-12T03:42:56.000Z	0
UgyCjyLAbnZ1bSCWwQt4AaABAg	カシオペアチャンネル	幕張メッセ‼️	幕張メッセ‼️	0	2019-09-12T03:42:37.000Z	2019-09-12T03:42:37.000Z	0
UgyYJoAveoj9XIl3Yxl4AaABAg	kっけい	めっせまくはり	めっせまくはり	0	2019-09-12T03:42:33.000Z	2019-09-12T03:42:33.000Z	0
UgzMKQYQtf211-FReFd4AaABAg	citron citron	現国の時間、長く感じるは本当にそう笑笑	現国の時間、長く感じるは本当にそう笑笑	5	2019-09-12T03:42:11.000Z	2019-09-12T03:42:11.000Z	0
UgzwOeM8dswndikdl8F4AaABAg	るる	幕張メッセなら聖地巡礼余裕だわ	幕張メッセなら聖地巡礼余裕だわ	0	2019-09-12T03:41:59.000Z	2019-09-12T03:41:59.000Z	0
UgzhF0cs32CjADAn8rF4AaABAg	vermouth	年齢で衣装変えてるのか	年齢で衣装変えてるのか	0	2019-09-12T03:41:56.000Z	2019-09-12T03:41:56.000Z	0
UgypSt_JdwN7M1m-bCt4AaABAg	小彥斯密達	喜歡這次的服裝👍	喜歡這次的服裝👍	0	2019-09-12T03:41:51.000Z	2019-09-12T03:41:51.000Z	0
UgwC0q6q04XxO3sjCdh4AaABAg	松田この	字幕で歌詞見たい	字幕で歌詞見たい	0	2019-09-12T03:41:45.000Z	2019-09-12T03:41:45.000Z	0
Ugwyx1eVjQfWpHt-Qv14AaABAg	a o	きょんこがこの髪型してるのすごく好き	きょんこがこの髪型してるのすごく好き	0	2019-09-12T03:41:39.000Z	2019-09-12T03:41:39.000Z	0
Ugw_ghGqlDC1fc5cfsh4AaABAg	ホセ大佐キューバの	いいね！！	いいね！！	0	2019-09-12T03:41:34.000Z	2019-09-12T03:41:34.000Z	0
UgwRffkE9fNUJw7Kfbp4AaABAg	くさき	気持ちが落ち着く曲だな	気持ちが落ち着く曲だな	5	2019-09-12T03:41:25.000Z	2019-09-12T03:41:25.000Z	0
UgxP2kLkHsvG5YIyoy54AaABAg	ファーストラビット	なんでこんなに優しい気持ちにしてくれるんだろう	なんでこんなに優しい気持ちにしてくれるんだろう	7	2019-09-12T03:41:17.000Z	2019-09-12T03:41:17.000Z	0
UgyWwDW20XPPF9UU_Ot4AaABAg	1%のねるで出来てる99%の日向坂と	よかった。ホントの日向坂46はこっちだ。	よかった。ホントの日向坂46はこっちだ。	3	2019-09-12T03:41:07.000Z	2019-09-12T03:41:07.000Z	0
UgyZiZN7akRnO3NfShx4AaABAg	Gaga man	密集して狭い画角でも全員が映るシーンがめちゃ良い！<br />そして富田鈴花の歌うシーン最高ダネ。	"密集して狭い画角でも全員が映るシーンがめちゃ良い！
そして富田鈴花の歌うシーン最高ダネ。"	0	2019-09-12T03:41:06.000Z	2019-09-12T03:41:06.000Z	0
UgzybyZ5jV0xixVjRrt4AaABAg	杉田時艱	"<a href=""https://www.youtube.com/watch?v=3ZR2_TK2lV0&amp;t=2m07s"">2:07</a> まなもやってんな笑"	2:07 まなもやってんな笑	0	2019-09-12T03:41:03.000Z	2019-09-12T03:41:03.000Z	1
UgzybyZ5jV0xixVjRrt4AaABAg.8zlU1VgUM8q8zlV8WJFQON	M H	完全に誘ってんじゃん	完全に誘ってんじゃん	0	2019-09-12T03:50:45.000Z	2019-09-12T03:50:45.000Z	0
Ugyt56NIyg4LKQfdQIF4AaABAg	金魚	好花やっぱ見せ方わかってらっしゃるw<br />可愛すぎて寿命伸びたかも。	"好花やっぱ見せ方わかってらっしゃるw
可愛すぎて寿命伸びたかも。"	9	2019-09-12T03:40:59.000Z	2019-09-12T03:40:59.000Z	0
Ugx2TdCE0zkpGHUMbe54AaABAg	パリッとぽてちぃ!	日向らしくて､元気貰える曲でいいね♪<br />それとなんといってもにぶちゃんツインテ神	"日向らしくて､元気貰える曲でいいね♪
それとなんといってもにぶちゃんツインテ神"	1	2019-09-12T03:40:51.000Z	2019-09-12T03:40:51.000Z	0
UgylaGWv9rXJilC7M2t4AaABAg	日向坂ヲタのとしマール	空色から、ひまわり色へ。	空色から、ひまわり色へ。	0	2019-09-12T03:40:38.000Z	2019-09-12T03:40:38.000Z	0
UgyuocqoPH6bL-2cobB4AaABAg	Riot !?	この曲が表題ではないことの強さ<br />幅・ギャップが生まれ日向坂をより一層面白くさせる	"この曲が表題ではないことの強さ
幅・ギャップが生まれ日向坂をより一層面白くさせる"	0	2019-09-12T03:40:26.000Z	2019-09-12T03:40:26.000Z	0
