id	author	text	raw_text	likes	published_at	updated_at	num_replies
Ugyt56NIyg4LKQfdQIF4AaABAg	金魚	好花やっぱ見せ方わかってらっしゃるw<br />可愛すぎて寿命伸びたかも。	"好花やっぱ見せ方わかってらっしゃるw
可愛すぎて寿命伸びたかも。"	0	2019-09-12T03:40:59.000Z	2019-09-12T03:40:59.000Z	0
Ugx2TdCE0zkpGHUMbe54AaABAg	パリッとぽてちぃ!	日向らしくて､元気貰える曲でいいね♪<br />それとなんといってもにぶちゃんツインテ神	"日向らしくて､元気貰える曲でいいね♪
それとなんといってもにぶちゃんツインテ神"	0	2019-09-12T03:40:51.000Z	2019-09-12T03:40:51.000Z	0
UgylaGWv9rXJilC7M2t4AaABAg	日向坂ヲタのとしマール	空色から、ひまわり色へ。	空色から、ひまわり色へ。	0	2019-09-12T03:40:38.000Z	2019-09-12T03:40:38.000Z	0
UgyuocqoPH6bL-2cobB4AaABAg	Riot !?	この曲が表題ではないことの強さ<br />幅・ギャップが生まれ日向坂をより一層面白くさせる	"この曲が表題ではないことの強さ
幅・ギャップが生まれ日向坂をより一層面白くさせる"	0	2019-09-12T03:40:26.000Z	2019-09-12T03:40:26.000Z	0
Ugy04RuI_bZNBWGBU6J4AaABAg	れみれみ	みーぱんかめっちゃ映っててクソ嬉しい！！みーぱんの笑顔はホンマ綺麗や！！	みーぱんかめっちゃ映っててクソ嬉しい！！みーぱんの笑顔はホンマ綺麗や！！	0	2019-09-12T03:40:18.000Z	2019-09-12T03:40:18.000Z	0
Ugxms52e8DDUYfaD7op4AaABAg	Nankatsu FOOTBALL	菜緒ちゃんしか勝たん！	菜緒ちゃんしか勝たん！	0	2019-09-12T03:40:10.000Z	2019-09-12T03:40:10.000Z	0
Ugz1txnsWD2ERGaaxlF4AaABAg	川上やふへゐ先生	高評価ボタン１個じゃ<br />足りないよ、、、	"高評価ボタン１個じゃ
足りないよ、、、"	0	2019-09-12T03:40:05.000Z	2019-09-12T03:40:05.000Z	0
Ugx93AnhLjlK25bFDQJ4AaABAg	にぶっこ。	こんなこと言うと気持ちわりぃな！って言われるかもしれないけど<br />ハッピーオーラっていいよね。	"こんなこと言うと気持ちわりぃな！って言われるかもしれないけど
ハッピーオーラっていいよね。"	0	2019-09-12T03:39:54.000Z	2019-09-12T03:39:54.000Z	1
Ugx93AnhLjlK25bFDQJ4AaABAg.8zlTu15SwPw8zlTxho75x7	M H	気持ちわりぃな！ぶっ飛ばすぞ〜〜〜〜	気持ちわりぃな！ぶっ飛ばすぞ〜〜〜〜	0	2019-09-12T03:40:24.000Z	2019-09-12T03:40:24.000Z	0
UgxmcJzan6LxkGGIUUp4AaABAg	MC banana man US	メンバー1人ずつのカットあるの本当にありがたいです。	メンバー1人ずつのカットあるの本当にありがたいです。	0	2019-09-12T03:39:45.000Z	2019-09-12T03:39:45.000Z	0
UgybmmZK-4k4LCBikS94AaABAg	ミスターGMARN	だーこの😍😍😍	だーこの😍😍😍	0	2019-09-12T03:39:45.000Z	2019-09-12T03:39:45.000Z	0
UgyRk9jLGbXRCYQcZrd4AaABAg	dokusasori	このMV見てたら時間が一瞬で過ぎた<br />現国の授業はあんなに長いのに…	"このMV見てたら時間が一瞬で過ぎた
現国の授業はあんなに長いのに…"	0	2019-09-12T03:39:44.000Z	2019-09-12T03:39:44.000Z	0
UgxHixNC0CFrfkodLWJ4AaABAg	K	現国の授業中は〜のメロディがたまらなく好きです。	現国の授業中は〜のメロディがたまらなく好きです。	0	2019-09-12T03:39:44.000Z	2019-09-12T03:39:44.000Z	0
UgyjZWr76l8Nhoxh7-J4AaABAg	uko- k	女子女子しててイイ振付！　なんか日向ダンスが確立してきた感じがする！	女子女子しててイイ振付！　なんか日向ダンスが確立してきた感じがする！	0	2019-09-12T03:39:43.000Z	2019-09-12T03:39:43.000Z	0
UgwYAeEgn4gSV9lr9y94AaABAg	こけたにはしくん	好きです。	好きです。	0	2019-09-12T03:39:39.000Z	2019-09-12T03:39:39.000Z	0
Ugz-aCAz89Lx1nbiXzB4AaABAg	もちまるこなの	全員が輝けるMVホントに最高すぎる！！	全員が輝けるMVホントに最高すぎる！！	1	2019-09-12T03:39:33.000Z	2019-09-12T03:39:33.000Z	0
UgwZvsbBv_7q2k-tBRJ4AaABAg	こうき	こういう雰囲気の曲の時の丹生ちゃんやっぱ強いな	こういう雰囲気の曲の時の丹生ちゃんやっぱ強いな	2	2019-09-12T03:39:23.000Z	2019-09-12T03:39:23.000Z	0
UgwMd6-QfiW4onErRWZ4AaABAg	くさき	こういう衣装を違和感なく着こなせるなんてどんだけ可愛いんだよ	こういう衣装を違和感なく着こなせるなんてどんだけ可愛いんだよ	0	2019-09-12T03:39:12.000Z	2019-09-12T03:39:12.000Z	0
UgwRCo7BJFfXEwT-VPt4AaABAg	ACRO POLIS	めっっっちゃ好きだこれw<br />異常なほどの中毒性あるし、MVもリピ確定です！！	"めっっっちゃ好きだこれw
異常なほどの中毒性あるし、MVもリピ確定です！！"	0	2019-09-12T03:39:10.000Z	2019-09-12T03:39:10.000Z	0
UgxBJm0_XUfvtAklPMF4AaABAg	くぼした	二十歳以下のメンバーは白線が入ってるのかな	二十歳以下のメンバーは白線が入ってるのかな	0	2019-09-12T03:39:03.000Z	2019-09-12T03:39:03.000Z	0
UgwcQPkVGkWFDdQgakB4AaABAg	丹生推し	丹生ちゃんのツインテールうおおおおおおおおおおおお❤❤❤❤❤❤❤❤❤❤❤❤❤❤❤❤❤❤❤❤❤❤❤❤❤❤❤❤❤❤❤❤	丹生ちゃんのツインテールうおおおおおおおおおおおお❤❤❤❤❤❤❤❤❤❤❤❤❤❤❤❤❤❤❤❤❤❤❤❤❤❤❤❤❤❤❤❤	0	2019-09-12T03:38:53.000Z	2019-09-12T03:38:53.000Z	0
UgxKbYNfCkTSKEoyM8d4AaABAg	Shun Ha	このMVはshort.verにしてはいけない。(運営様本当にお願いします。)	このMVはshort.verにしてはいけない。(運営様本当にお願いします。)	1	2019-09-12T03:38:42.000Z	2019-09-12T03:38:42.000Z	0
UgyjE1BAA6jqvDt_qM94AaABAg	おつかれ	アレだよね自然と笑顔になる感じのMV	アレだよね自然と笑顔になる感じのMV	0	2019-09-12T03:38:22.000Z	2019-09-12T03:38:22.000Z	0
Ugw452IG1CLRbLksLlB4AaABAg	こっつ	やんちゃるめいちゃんなんか身長小さく感じたんだけど（いつも以上に	やんちゃるめいちゃんなんか身長小さく感じたんだけど（いつも以上に	0	2019-09-12T03:38:19.000Z	2019-09-12T03:38:19.000Z	0
Ugx93BczcSHOT1-b-a14AaABAg	セクロム仮面	皆の笑顔が輝いてる	皆の笑顔が輝いてる	0	2019-09-12T03:38:06.000Z	2019-09-12T03:38:06.000Z	0
UgxQZKqlzRZ5OxAe_8x4AaABAg	うどん屋	ぐるぐるピーマン君だよ	ぐるぐるピーマン君だよ	0	2019-09-12T03:38:00.000Z	2019-09-12T03:38:00.000Z	0
UgzSpeAj3oZ5tOXxGHJ4AaABAg	Miho Watanabe	This song gives me Good Vibes 👍👍 <br /><br />Love it from 🇵🇭	"This song gives me Good Vibes 👍👍 

Love it from 🇵🇭"	0	2019-09-12T03:37:44.000Z	2019-09-12T03:37:44.000Z	0
UgwlUKo-7KFrA-Puvih4AaABAg	ぶーぶ	丹生ちゃんツインテかわいいね😍	丹生ちゃんツインテかわいいね😍	0	2019-09-12T03:37:34.000Z	2019-09-12T03:37:34.000Z	0
UgyXA10aalVkr0IlqxZ4AaABAg	アフロ犬	こういう天気良い外でダンスしてるMVは爽やかでさ、思わずサトミツもほっこりしてるはず。　良いね👍<br />だーこの、お鈴、ミホワタナベのゴリゴリドーナッツなんか好き	"こういう天気良い外でダンスしてるMVは爽やかでさ、思わずサトミツもほっこりしてるはず。　良いね👍
だーこの、お鈴、ミホワタナベのゴリゴリドーナッツなんか好き"	0	2019-09-12T03:37:31.000Z	2019-09-12T03:37:31.000Z	0
UgygGXXXUx4ttFH26Bl4AaABAg	ミスターGMARN	現国って、現代文のこと？<br />ワイのとこは現文って略してたぞ	"現国って、現代文のこと？
ワイのとこは現文って略してたぞ"	0	2019-09-12T03:37:14.000Z	2019-09-12T03:37:14.000Z	0
UgxOkdTh_6iR9b3FbXt4AaABAg	夜明了よあけりょう	🍓可愛い	🍓可愛い	0	2019-09-12T03:37:07.000Z	2019-09-12T03:37:07.000Z	0
UgyxFtTrEIrXWsTOPNV4AaABAg	MC banana man US	なっちょ可愛い(^^ゞ 以上ォォォｰ!!	なっちょ可愛い(^^ゞ 以上ォォォｰ!!	0	2019-09-12T03:37:05.000Z	2019-09-12T03:37:05.000Z	0
UgzGefNgk8aQXk3seXJ4AaABAg	NoGiZaKa Cheer	丹生ちゃんの二つ結び<br /><br /><br /><br /><br /><br /><br /><br />今日も平和です	"丹生ちゃんの二つ結び







今日も平和です"	0	2019-09-12T03:36:51.000Z	2019-09-12T03:36:51.000Z	0
UgzaRINTuhMAXWahX1R4AaABAg	筋肉いっぱい	衣装が曲と合ってる	衣装が曲と合ってる	1	2019-09-12T03:36:41.000Z	2019-09-12T03:36:41.000Z	0
Ugyfr3gbPYelCYg5sl94AaABAg	いのまる。	きょんこたんかわいいいいいい⸜❤︎⸝‍	きょんこたんかわいいいいいい⸜❤︎⸝‍	0	2019-09-12T03:36:33.000Z	2019-09-12T03:36:33.000Z	0
UgzGdrxzA1HB_guizWx4AaABAg	ディフェンスに定評のある池上	なんだこのハッピーオーラ溢れるMVはぁ！！<br />ハッピーは全部ここに詰まってたのかゴラァ！！！！	"なんだこのハッピーオーラ溢れるMVはぁ！！
ハッピーは全部ここに詰まってたのかゴラァ！！！！"	0	2019-09-12T03:36:29.000Z	2019-09-12T03:36:29.000Z	0
Ugxl4Lk-Z8GvLT8HQgd4AaABAg	ユークリフ	彩花ちゃん<br />                  かわいすぎて<br /> 　　                                 こまっちぇり	"彩花ちゃん
                  かわいすぎて
 　　                                 こまっちぇり"	0	2019-09-12T03:36:24.000Z	2019-09-12T03:36:24.000Z	0
UgzpwHDhzU8pO11LxS94AaABAg	nandeyan	"<a href=""https://www.youtube.com/watch?v=3ZR2_TK2lV0&amp;t=3m50s"">3:50</a>目動きすぎて死ぬかと思った<br /><br />どこ見たらええねん…"	"3:50目動きすぎて死ぬかと思った

どこ見たらええねん…"	0	2019-09-12T03:36:07.000Z	2019-09-12T03:36:07.000Z	0
UgxBCQVyXkuP9HftNsJ4AaABAg	東大&女装 トレビのいずみん	日向坂、大サビでキー上がりがち	日向坂、大サビでキー上がりがち	0	2019-09-12T03:36:04.000Z	2019-09-12T03:36:04.000Z	0
UgzNicmY-lnB7QRjeU94AaABAg	くるくるぱーま	"<a href=""https://www.youtube.com/watch?v=3ZR2_TK2lV0&amp;t=1m45s"">1:45</a> 美しさと可愛さを兼ね備えたKAWADAさん"	1:45 美しさと可愛さを兼ね備えたKAWADAさん	0	2019-09-12T03:35:42.000Z	2019-09-12T03:35:42.000Z	0
UgwOrm95kgccjtYZ6Nl4AaABAg	k k	全員が尊い・・・<br /><br /><br />どうなるか分からないけど井口頑張れよ！！	"全員が尊い・・・


どうなるか分からないけど井口頑張れよ！！"	0	2019-09-12T03:35:32.000Z	2019-09-12T03:35:32.000Z	0
UgyZ8QEGv__NaqsDwAx4AaABAg	依田優太	めいめいめっちゃ可愛い<br />髪型が神がかってる！	"めいめいめっちゃ可愛い
髪型が神がかってる！"	1	2019-09-12T03:35:27.000Z	2019-09-12T03:35:27.000Z	0
UgzS1aZQwsLH0l4ZeFJ4AaABAg	ぶーぶ	丹生美久最強すぎるぅぅぅあ	丹生美久最強すぎるぅぅぅあ	0	2019-09-12T03:35:25.000Z	2019-09-12T03:35:25.000Z	0
UgzkU7fx5ZLBpGpfRUh4AaABAg	たこ焼きお好み焼き	"<a href=""https://www.youtube.com/watch?v=3ZR2_TK2lV0&amp;t=2m11s"">2:11</a>の高本なんか笑った笑笑"	2:11の高本なんか笑った笑笑	1	2019-09-12T03:35:24.000Z	2019-09-12T03:35:24.000Z	0
UgxpA05y3JYawGBl-bp4AaABAg	あまいもすいも	めいめいの短い三つ編みが<br />5歳児加速させててかわいい。	"めいめいの短い三つ編みが
5歳児加速させててかわいい。"	1	2019-09-12T03:35:20.000Z	2019-09-12T03:35:20.000Z	0
UgzQEjulnNObPdCjwh94AaABAg	たなからぽたもち	ひとりひとりの表情がちゃんと見えるからこういう撮り方がすごい好きです…<br /><br />普通なのかもだけど全員映るとめちゃくちゃ嬉しいし、全員素敵だからもっとみんなを映してー！ってなる！日向坂ちゃんが関わると時間どれだけあっても足りないって感じるのでやっぱり時計は信用できないですね☺️	"ひとりひとりの表情がちゃんと見えるからこういう撮り方がすごい好きです…

普通なのかもだけど全員映るとめちゃくちゃ嬉しいし、全員素敵だからもっとみんなを映してー！ってなる！日向坂ちゃんが関わると時間どれだけあっても足りないって感じるのでやっぱり時計は信用できないですね☺️"	1	2019-09-12T03:35:09.000Z	2019-09-12T03:35:09.000Z	0
UgwSDTc7nB5t1FxWPy54AaABAg	ヨッシー	丹生ちゃんはいつ見ても笑顔が素敵🤩	丹生ちゃんはいつ見ても笑顔が素敵🤩	1	2019-09-12T03:35:08.000Z	2019-09-12T03:35:08.000Z	0
UgwcSTXAvOb1_v1lFTJ4AaABAg	high oh	"<a href=""https://www.youtube.com/watch?v=3ZR2_TK2lV0&amp;t=3m42s"">3:42</a> 一瞬間の向日葵🌻"	3:42 一瞬間の向日葵🌻	0	2019-09-12T03:35:07.000Z	2019-09-12T03:35:07.000Z	0
UgwjYq_LPi3AH6aXKRx4AaABAg	ふなばしアンデルセン公園	幕張メッセじゃん！	幕張メッセじゃん！	0	2019-09-12T03:35:04.000Z	2019-09-12T03:35:04.000Z	0
UgwYMHWaGtWUsExKCrB4AaABAg	RAUFU FK	"<a href=""https://www.youtube.com/watch?v=3ZR2_TK2lV0&amp;t=3m53s"">3:53</a> が特に日向坂を感じられる。<br /><br />全員が映ってるって感じが好きでしかない。"	"3:53 が特に日向坂を感じられる。

全員が映ってるって感じが好きでしかない。"	1	2019-09-12T03:34:58.000Z	2019-09-12T03:34:58.000Z	0
UgySZfqRk8y3Ge_ZikB4AaABAg	epo.com	表題よりすこ	表題よりすこ	1	2019-09-12T03:34:57.000Z	2019-09-12T03:34:57.000Z	0
UgzpSnpS5EcdMfkokmx4AaABAg	あやか	井口が更に見つけづらくなってて感動…<br />早く戻ってきてほしいな	"井口が更に見つけづらくなってて感動…
早く戻ってきてほしいな"	0	2019-09-12T03:34:40.000Z	2019-09-12T03:34:40.000Z	0
UgzFY5XwvzxxwkkzGYt4AaABAg	はは	井口は草	井口は草	0	2019-09-12T03:34:32.000Z	2019-09-12T03:34:32.000Z	0
UgwHv9UMriE1f-4XPq54AaABAg	。、	イイネ！	イイネ！	0	2019-09-12T03:34:32.000Z	2019-09-12T03:34:32.000Z	0
Ugzts11RAhcfwNRSNll4AaABAg	p i	曲はいいのにMVこれはドイヒー	曲はいいのにMVこれはドイヒー	0	2019-09-12T03:34:31.000Z	2019-09-12T03:34:31.000Z	0
UgyYUp9l3fiZWXf0B2t4AaABAg	InvzBLe	"Lots of love from Malaysian Ohisama ❤ <a href=""http://www.youtube.com/results?search_query=%23%E6%97%A5%E5%90%91%E5%9D%8246"">#日向坂46</a> <a href=""http://www.youtube.com/results?search_query=%23Hinatazaka46"">#Hinatazaka46</a>"	Lots of love from Malaysian Ohisama ❤ #日向坂46 #Hinatazaka46	0	2019-09-12T03:34:29.000Z	2019-09-12T03:34:29.000Z	0
UgxV9U6B5raCvnaJkEN4AaABAg	jetti cruz	such heavenly happy aura	such heavenly happy aura	0	2019-09-12T03:34:28.000Z	2019-09-12T03:34:28.000Z	0
UgzIZkuRM9MpKz6dEQl4AaABAg	にかにか	あいかわらずかわいい衣装で、、<br /><br /><br /><br /><br /><br />もちろん顔面もね❤️	"あいかわらずかわいい衣装で、、





もちろん顔面もね❤️"	2	2019-09-12T03:34:26.000Z	2019-09-12T03:34:26.000Z	0
Ugxr12BqaC-PmJdEeHB4AaABAg	T Y	日向坂はやっぱ元気出る<br />ハッピーオーラやな！	"日向坂はやっぱ元気出る
ハッピーオーラやな！"	1	2019-09-12T03:34:22.000Z	2019-09-12T03:34:22.000Z	0
UgwPRlKM0o8ZxzGT92V4AaABAg	ShengNing Hsu	MVを見たら絶対好きになる曲<br />かわいい	"MVを見たら絶対好きになる曲
かわいい"	1	2019-09-12T03:34:10.000Z	2019-09-12T03:34:10.000Z	0
Ugw-22SVam1vSM_lhuJ4AaABAg	にんじん	アイドルの笑顔は最高だ<br /><br />いいね！	"アイドルの笑顔は最高だ

いいね！"	1	2019-09-12T03:34:08.000Z	2019-09-12T03:34:08.000Z	0
Ugzz222dCMqBI72OG_B4AaABAg	Haihui Wei	I am in Singapore and I can watch this PV, Thank you Seed &amp; Flower. 外国のおひさまです。	I am in Singapore and I can watch this PV, Thank you Seed & Flower. 外国のおひさまです。	1	2019-09-12T03:33:51.000Z	2019-09-12T03:33:51.000Z	0
UgwTyC4q2x0Dy7ZJN114AaABAg	五十嵐宗一郎	やっぱ笑ってる顔が一番や	やっぱ笑ってる顔が一番や	0	2019-09-12T03:33:51.000Z	2019-09-12T03:33:51.000Z	0
UgxjRWBOSZrhz_sRVsR4AaABAg	RAUFU FK	松田好花さんは天使でしかない。<br /><br />ちょくちょく京子さんに被ってるとこも天使でしかないwww	"松田好花さんは天使でしかない。

ちょくちょく京子さんに被ってるとこも天使でしかないwww"	1	2019-09-12T03:33:49.000Z	2019-09-12T03:33:49.000Z	0
UgwHIO3ytUfhSCKefLh4AaABAg	うめ	テーマカラー、黄色でも良かったんじゃないかってくらい似合うね！！	テーマカラー、黄色でも良かったんじゃないかってくらい似合うね！！	0	2019-09-12T03:33:38.000Z	2019-09-12T03:33:38.000Z	0
UgwrblKapyoGzL0XR_N4AaABAg	お寿司かねぇので	きたー	きたー	0	2019-09-12T03:33:37.000Z	2019-09-12T03:33:37.000Z	0
UgxMGUt7OSraVzi6ewR4AaABAg	**	安定の可愛さ	安定の可愛さ	0	2019-09-12T03:33:27.000Z	2019-09-12T03:33:27.000Z	0
UgwsbPnK9iV4ZxGsut54AaABAg	RAUFU FK	こりゃ、日向けやき合わせても史上最高に好きな曲かもしれん。	こりゃ、日向けやき合わせても史上最高に好きな曲かもしれん。	0	2019-09-12T03:33:25.000Z	2019-09-12T03:33:25.000Z	0
UgwoxiohEk67LvtkD0R4AaABAg	れ い。	皆笑顔が可愛すぎて…泣けてきた…😖	皆笑顔が可愛すぎて…泣けてきた…😖	1	2019-09-12T03:33:20.000Z	2019-09-12T03:33:20.000Z	0
UgyNfYI-RK6WVMP-0AZ4AaABAg	りんごまる	にぶちゃん！かわいいいい！！	にぶちゃん！かわいいいい！！	0	2019-09-12T03:33:04.000Z	2019-09-12T03:33:04.000Z	0
UgwqVX3eF0OfJL-Xmcx4AaABAg	さば	ロケのシーンでリップシンクが無いのはなんでやろ？歌詞確定してなかったのかな<br />その分みんなの笑顔が見れていいけどw	"ロケのシーンでリップシンクが無いのはなんでやろ？歌詞確定してなかったのかな
その分みんなの笑顔が見れていいけどw"	1	2019-09-12T03:32:58.000Z	2019-09-12T03:32:58.000Z	0
UgyvOqiOJ_Tvi2xiAaN4AaABAg	高橋優輝	今日もこさかなが尊い🥺	今日もこさかなが尊い🥺	0	2019-09-12T03:32:55.000Z	2019-09-12T03:32:55.000Z	0
Ugxi-qkZmnqCjWtL39t4AaABAg	カズさん	良い！！キュン ドレミ とまた変わって良い！！	良い！！キュン ドレミ とまた変わって良い！！	1	2019-09-12T03:32:54.000Z	2019-09-12T03:32:54.000Z	0
Ugyl5qLyQpDndfJMzn54AaABAg	橋本奈々未	こういうのでいいんだよ	こういうのでいいんだよ	0	2019-09-12T03:32:48.000Z	2019-09-12T03:32:48.000Z	0
UgxxGz76vlT7xqjC1BJ4AaABAg	YNDよし、	あゃめぃちゃんの髪型と髪の色がシンメっぽくて最高‼️	あゃめぃちゃんの髪型と髪の色がシンメっぽくて最高‼️	1	2019-09-12T03:32:39.000Z	2019-09-12T03:32:39.000Z	0
UgwwZi-NWpJDDZJIvJ54AaABAg	ごみこみ	井口大好きだよ〜💘<br /><br />ばうちゃんが、笑顔で過ごせるのが<br />一番嬉しいよ。	"井口大好きだよ〜💘

ばうちゃんが、笑顔で過ごせるのが
一番嬉しいよ。"	0	2019-09-12T03:32:33.000Z	2019-09-12T03:32:33.000Z	0
UgyEM0azfpz1oWkAhKt4AaABAg	ナッツナッツ	個人的に表題よりこっちの方が好きや	個人的に表題よりこっちの方が好きや	1	2019-09-12T03:32:27.000Z	2019-09-12T03:32:27.000Z	0
Ugyih0tAGoLFekFU9I94AaABAg	めなみひき	日向坂には元気貰いすぎてもう感謝しかない。<br />日向坂が存在する時代に生まれてきて良かったまであるw	"日向坂には元気貰いすぎてもう感謝しかない。
日向坂が存在する時代に生まれてきて良かったまであるw"	4	2019-09-12T03:32:26.000Z	2019-09-12T03:32:26.000Z	0
Ugx98otctypToG0jjMl4AaABAg	ささくれパウダー	９３３の口笛うますぎや	９３３の口笛うますぎや	1	2019-09-12T03:32:18.000Z	2019-09-12T03:32:18.000Z	0
UgwR8I0up2CX359AOuN4AaABAg	五十嵐宗一郎	この曲調とテンポがくっそハマる<br /><br />マジで作ったやつ天才	"この曲調とテンポがくっそハマる

マジで作ったやつ天才"	2	2019-09-12T03:32:12.000Z	2019-09-12T03:32:12.000Z	0
UgxsdpDJ996FufwEfJl4AaABAg	ーマミィー:ymammy	これって衣装は年齢で分けてるのかな？	これって衣装は年齢で分けてるのかな？	0	2019-09-12T03:32:10.000Z	2019-09-12T03:32:10.000Z	0
UgwHq6w9iSOuqzZoNet4AaABAg	ペリッパー	"<a href=""https://www.youtube.com/watch?v=3ZR2_TK2lV0&amp;t=1m30s"">1:30</a>　現国の時、文読んでるフリして急に入ってきた犯罪者倒す妄想してたわ。"	1:30　現国の時、文読んでるフリして急に入ってきた犯罪者倒す妄想してたわ。	0	2019-09-12T03:32:09.000Z	2019-09-12T03:32:09.000Z	0
UgxS4UOpAIUHbDJsMLF4AaABAg	ふぁや.	"<a href=""https://www.youtube.com/watch?v=3ZR2_TK2lV0&amp;t=3m43s"">3:43</a> やっぱかとしの歌声素敵だなぁ"	3:43 やっぱかとしの歌声素敵だなぁ	1	2019-09-12T03:31:54.000Z	2019-09-12T03:31:54.000Z	0
UgyS_UTyOLG2Yfs_aJx4AaABAg	나미	振り付けもPVもめっちゃかわいいーーー！きょんこハーフツイン正義。	振り付けもPVもめっちゃかわいいーーー！きょんこハーフツイン正義。	1	2019-09-12T03:31:40.000Z	2019-09-12T03:31:40.000Z	0
Ugy0xfT39P4KejEMZJV4AaABAg	1000 orakio	本編だわ	本編だわ	0	2019-09-12T03:31:39.000Z	2019-09-12T03:31:39.000Z	0
Ugwg4YIm2w_cxvMwA9d4AaABAg	むらびと	ラスサビのみんなの笑顔にやられました、やっぱ日向坂46最高だな！！	ラスサビのみんなの笑顔にやられました、やっぱ日向坂46最高だな！！	0	2019-09-12T03:31:38.000Z	2019-09-12T03:31:38.000Z	0
UgxeLiqd9Koj8uRW6bx4AaABAg	YATO	かとし美人すぎ	かとし美人すぎ	0	2019-09-12T03:31:35.000Z	2019-09-12T03:31:35.000Z	0
UgwJpVqolEQhmCp4nC14AaABAg	ちょんまげ詩織さんうにゃぽ	オタクの大好きな聖地巡礼できんぢゃん‼️	オタクの大好きな聖地巡礼できんぢゃん‼️	1	2019-09-12T03:31:14.000Z	2019-09-12T03:31:14.000Z	0
Ugzxd6Fe0mLZpjSf-uJ4AaABAg	カルテット	今回も松田好花の笑顔が輝いてますわ	今回も松田好花の笑顔が輝いてますわ	0	2019-09-12T03:31:09.000Z	2019-09-12T03:31:09.000Z	0
UgzIvdxzZ24H7MkMYO14AaABAg	なかちゃん	まじで『ホントの時間』神曲じゃない？	まじで『ホントの時間』神曲じゃない？	4	2019-09-12T03:30:54.000Z	2019-09-12T03:30:54.000Z	0
UgxFw6NDxxQt12TGFJ94AaABAg	ゴキブリ	1番は太陽で2番目は月みたい。ショートにならないで、、、	1番は太陽で2番目は月みたい。ショートにならないで、、、	0	2019-09-12T03:30:54.000Z	2019-09-12T03:30:54.000Z	0
UgyuEVP3ltlw8Agfmtp4AaABAg	TA TA	幕張メッセ行くだけで聖地巡礼になるの楽でいいな。	幕張メッセ行くだけで聖地巡礼になるの楽でいいな。	0	2019-09-12T03:30:39.000Z	2019-09-12T03:30:39.000Z	0
UgwBgS-I4z7y_3fO3314AaABAg	YATO	まるで向日葵のようだ<br />これからもファンを照らしてくれる存在であってくれ	"まるで向日葵のようだ
これからもファンを照らしてくれる存在であってくれ"	0	2019-09-12T03:30:37.000Z	2019-09-12T03:30:37.000Z	0
UgyWA9hoC6Ly-XnsANJ4AaABAg	パリィ成道	ちゃんとハッピーオーラで嬉しいです。	ちゃんとハッピーオーラで嬉しいです。	0	2019-09-12T03:30:36.000Z	2019-09-12T03:30:36.000Z	0
UgwW-yGvQ6COczUps7x4AaABAg	ざわざわバンアタック	本当に笑顔が似合うグループですね。	本当に笑顔が似合うグループですね。	1	2019-09-12T03:30:30.000Z	2019-09-12T03:30:30.000Z	0
UgzygdYbVFqjUaYZIFJ4AaABAg	こさかな&にぶちゃん	恋愛禁止(バレた場合一定数の批判とファンが離れるのは必然だけどそれでも良いなら別にしてもいいよ)だよね？多分	恋愛禁止(バレた場合一定数の批判とファンが離れるのは必然だけどそれでも良いなら別にしてもいいよ)だよね？多分	0	2019-09-12T03:30:30.000Z	2019-09-12T03:30:30.000Z	1
UgzygdYbVFqjUaYZIFJ4AaABAg.8zlSp9zrSff8zlTykVowMs	亜阿	恋愛自由だよ	恋愛自由だよ	0	2019-09-12T03:40:32.000Z	2019-09-12T03:40:32.000Z	0
UgwEJ6vS8chgH3POXCN4AaABAg	TV shmn	なんで井口いるの？ブスでダンスも歌も下手でそのくせファン騙しててこいつ早く解雇してくんね？	なんで井口いるの？ブスでダンスも歌も下手でそのくせファン騙しててこいつ早く解雇してくんね？	0	2019-09-12T03:30:27.000Z	2019-09-12T03:30:27.000Z	0
UgydoWpAA1ejDXu_V8h4AaABAg	フィンランド生田	欅坂46の二人セゾンっぽいね❗	欅坂46の二人セゾンっぽいね❗	0	2019-09-12T03:30:27.000Z	2019-09-12T03:30:27.000Z	0
UgxjAjrl3MQYT1Lpg-Z4AaABAg	かわ	また同じセンターかよとか違うセンターも見たいとかわざわざここに書く必要ないと思うんすよ	また同じセンターかよとか違うセンターも見たいとかわざわざここに書く必要ないと思うんすよ	4	2019-09-12T03:30:25.000Z	2019-09-12T03:30:25.000Z	0
UgzCqnXxKdV-s-BSZT94AaABAg	ヤ ギ	このMVみんな可愛すぎる😭💖	このMVみんな可愛すぎる😭💖	0	2019-09-12T03:30:22.000Z	2019-09-12T03:30:22.000Z	0
UgwkHg_YSFNjV6I1yF54AaABAg	五十嵐宗一郎	これ超好きなやつ<br /><br />潮の笑顔がたまんないねぇ	"これ超好きなやつ

潮の笑顔がたまんないねぇ"	0	2019-09-12T03:30:05.000Z	2019-09-12T03:30:05.000Z	0
