id	author	text	raw_text	likes	published_at	updated_at	num_replies
UgxyCeEqBnZuI8KmvHV4AaABAg	とめ	"<a href=""https://www.youtube.com/watch?v=3ZR2_TK2lV0&amp;t=4m25s"">4:25</a> からのめいめいのサイズ感たまらなく可愛い、てか全員笑顔なの素敵すぎて浄化される"	4:25 からのめいめいのサイズ感たまらなく可愛い、てか全員笑顔なの素敵すぎて浄化される	0	2019-09-12T06:32:54.000Z	2019-09-12T06:32:54.000Z	0
UgzFb-D_gZIkYx2aCUB4AaABAg	田口圭	久美だけ1じゃなくて1.5に立ってる？笑	久美だけ1じゃなくて1.5に立ってる？笑	0	2019-09-12T06:30:42.000Z	2019-09-12T06:30:42.000Z	0
UgxnrSSm0gVUUId1qTV4AaABAg	推すしかない日向坂46を	良いね！<br />曲とは関係無いけど日向坂は選抜制はやらないで欲しいな	"良いね！
曲とは関係無いけど日向坂は選抜制はやらないで欲しいな"	0	2019-09-12T06:30:29.000Z	2019-09-12T06:30:29.000Z	0
UgwOyESKa1ZaFo-Gaf14AaABAg	そったん そったん	えっ顔小さすぎないん？みんな。	えっ顔小さすぎないん？みんな。	0	2019-09-12T06:29:52.000Z	2019-09-12T06:29:52.000Z	0
UgzojxzQ0XK4iGmcxzp4AaABAg	かたかた	よく仕組みが理解できてないから聞くけど、ひよたんと影が復帰したらこのフォーメーションに入ること出来るん？	よく仕組みが理解できてないから聞くけど、ひよたんと影が復帰したらこのフォーメーションに入ること出来るん？	0	2019-09-12T06:29:34.000Z	2019-09-12T06:29:34.000Z	0
UgztYUVWUSYemaDsxN94AaABAg	ルンルンランラン	"<a href=""https://www.youtube.com/watch?v=3ZR2_TK2lV0&amp;t=1m17s"">1:17</a>からの振り付け可愛すぎる"	1:17からの振り付け可愛すぎる	0	2019-09-12T06:28:45.000Z	2019-09-12T06:28:45.000Z	0
UgyHqqxUJFNBOwabmPN4AaABAg	村瀬紗英	すきですうううう！！！！！！！！！	すきですうううう！！！！！！！！！	0	2019-09-12T06:27:21.000Z	2019-09-12T06:27:21.000Z	0
UgwdbxKUqRvGMeyKR9Z4AaABAg	エルサアナ	どうしよう、すんごくすんごーく可愛い😂😂	どうしよう、すんごくすんごーく可愛い😂😂	0	2019-09-12T06:26:42.000Z	2019-09-12T06:26:42.000Z	0
UgyjK8TfyEGiK2g4C354AaABAg	ぬぺぬぺ	Oh〜 <br /><br />偶然ばったり　ショッピングモールで会って<br />立ち話をした　夕暮れの手前で <br />お互いに好きな　アニメで盛り上がり<br />DVDを貸し合う　約束をしただけで<br /><br />もう、いつの間にか　街明かり付き始めて <br />頭上の空、ふと見上げる　星がパラパラって輝いた <br />そろそろ家に帰らなきゃ　なんて急に言い出して <br />腕時計をチラリ見たら　さっきから<br />１時間経ってた <br /><br />ホントの時間はどれだけ進んでたのか <br />時計なんか信用しない <br />君と過ごす時だけ時空が歪むよ <br />あっという間に過ぎる <br />だって、現国の授業中は<br />ゆっくりと針が進むし <br />もったいぶったように<br />速くなったり、遅くなったり、いい加減 <br />Oh〜 <br /><br />favoriteアニソン　一緒に口ずさみ <br />話はまだまだ　尽きなかったけれど <br /><br />もうショーウィンドウの　照明も消え始めて<br />駐車場から車が出る　残ったのは僕達だけ<br />続きはまたいつかなんて　いつもならば帰るのに <br />「ねぇ、明日も会えない？」って　何故だろう<br />１秒で聞いてた <br /><br />ホントの時間のスピードとはどれくらい？<br />今日の日付が変わるまで <br />君を想う気持ちが急がせるけれど <br />止まったように見える <br />だって、真っ暗な空の色が<br />白むにまだかかりそうだし <br />一日のその中で<br />一番遅い進み方だと思うんだ<br /><br />ねぇ、誰がネジを巻いて調節しているの？<br />一応の目安になる時間はあるだろう <br />チクタクってきっとリズム刻んでる <br />ねぇ、だけど当てにならないような針たちを<br />どうにかまとめて世界中を統一してる <br />あれこれどれも今　勝手に動き<br />速さ一定してない <br /><br />ホントの時間のスピードとはどれくらい？<br />今日の日付が変わるまで <br />君を想う気持ちが急がせるけれど<br />止まったように見える <br /><br />ホントの時間はどれだけ進んでたのか <br />時計なんか信用しない <br />君と過ごす時だけ時空が歪むよ <br />あっという間に過ぎる <br />だって、現国の授業中は<br />ゆっくりと針が進むし <br />もったいぶったように速くなったり<br />遅くなったり、いい加減 <br />Oh〜	"Oh〜 

偶然ばったり　ショッピングモールで会って
立ち話をした　夕暮れの手前で 
お互いに好きな　アニメで盛り上がり
DVDを貸し合う　約束をしただけで

もう、いつの間にか　街明かり付き始めて 
頭上の空、ふと見上げる　星がパラパラって輝いた 
そろそろ家に帰らなきゃ　なんて急に言い出して 
腕時計をチラリ見たら　さっきから
１時間経ってた 

ホントの時間はどれだけ進んでたのか 
時計なんか信用しない 
君と過ごす時だけ時空が歪むよ 
あっという間に過ぎる 
だって、現国の授業中は
ゆっくりと針が進むし 
もったいぶったように
速くなったり、遅くなったり、いい加減 
Oh〜 

favoriteアニソン　一緒に口ずさみ 
話はまだまだ　尽きなかったけれど 

もうショーウィンドウの　照明も消え始めて
駐車場から車が出る　残ったのは僕達だけ
続きはまたいつかなんて　いつもならば帰るのに 
「ねぇ、明日も会えない？」って　何故だろう
１秒で聞いてた 

ホントの時間のスピードとはどれくらい？
今日の日付が変わるまで 
君を想う気持ちが急がせるけれど 
止まったように見える 
だって、真っ暗な空の色が
白むにまだかかりそうだし 
一日のその中で
一番遅い進み方だと思うんだ

ねぇ、誰がネジを巻いて調節しているの？
一応の目安になる時間はあるだろう 
チクタクってきっとリズム刻んでる 
ねぇ、だけど当てにならないような針たちを
どうにかまとめて世界中を統一してる 
あれこれどれも今　勝手に動き
速さ一定してない 

ホントの時間のスピードとはどれくらい？
今日の日付が変わるまで 
君を想う気持ちが急がせるけれど
止まったように見える 

ホントの時間はどれだけ進んでたのか 
時計なんか信用しない 
君と過ごす時だけ時空が歪むよ 
あっという間に過ぎる 
だって、現国の授業中は
ゆっくりと針が進むし 
もったいぶったように速くなったり
遅くなったり、いい加減 
Oh〜"	0	2019-09-12T06:26:35.000Z	2019-09-12T06:26:35.000Z	0
UgwZ-TC2dgH_e6FX-ch4AaABAg	TO_SHI_G4	この曲は終わり感があるから、アルバムに入れるなら最後にして欲しいしライブでも本編ラストかアンコールラストにやって欲しいな	この曲は終わり感があるから、アルバムに入れるなら最後にして欲しいしライブでも本編ラストかアンコールラストにやって欲しいな	0	2019-09-12T06:26:26.000Z	2019-09-12T06:26:26.000Z	0
Ugy8kwCp6AQbCdVjSP54AaABAg	顔面京ちゃん	天使しかいないの草	天使しかいないの草	1	2019-09-12T06:25:11.000Z	2019-09-12T06:25:11.000Z	0
UgwCPyf29qo1SaohVLd4AaABAg	つりい	めみセンターに置きたい曲だな	めみセンターに置きたい曲だな	0	2019-09-12T06:23:35.000Z	2019-09-12T06:23:35.000Z	0
UgyYZqlNgR3RduMQoR14AaABAg	さて食べよう	サビの、テンポ感すごい好き！<br />今までで1番好きかも	"サビの、テンポ感すごい好き！
今までで1番好きかも"	0	2019-09-12T06:23:33.000Z	2019-09-12T06:23:33.000Z	0
UgzOegL59TQjuxVQprF4AaABAg	すーすー	撮影地、おひさまは絶対ピンときたはず!<br />イントロとアウトロの口笛はささくとすーちゃらしい。<br /><br />てか衣装秋っぽくて可愛いね☺︎<br />日向坂は暖色系すごく似合う!	"撮影地、おひさまは絶対ピンときたはず!
イントロとアウトロの口笛はささくとすーちゃらしい。

てか衣装秋っぽくて可愛いね☺︎
日向坂は暖色系すごく似合う!"	0	2019-09-12T06:23:25.000Z	2019-09-12T06:23:25.000Z	0
UgxWfkS-V1hZwkP6l2d4AaABAg	さり	小坂ちゃん元気なくない？最近・・心配	小坂ちゃん元気なくない？最近・・心配	0	2019-09-12T06:22:35.000Z	2019-09-12T06:22:35.000Z	0
UgwpxnlaVd7jXVhB6qV4AaABAg	ルンルンランラン	おれも混ぜてくれんかな	おれも混ぜてくれんかな	0	2019-09-12T06:22:11.000Z	2019-09-12T06:22:11.000Z	0
UgxfbgPrLy4W0Imy57R4AaABAg	ネカマっちょ	衣装のふんわりした色合い似合いすぎひん？？<br />デザイナー有能すぎ	"衣装のふんわりした色合い似合いすぎひん？？
デザイナー有能すぎ"	0	2019-09-12T06:21:58.000Z	2019-09-12T06:21:58.000Z	0
UgyRsNIZ3we034qxv014AaABAg	パリッとぽてちぃ!	黄色って<br />日向らしくて<br />イイね！！	"黄色って
日向らしくて
イイね！！"	0	2019-09-12T06:21:49.000Z	2019-09-12T06:21:49.000Z	0
UgwPm2lBAOI50rKXm4h4AaABAg	h o	ハウスとかガルルみたいな爆上げする曲ください	ハウスとかガルルみたいな爆上げする曲ください	0	2019-09-12T06:21:27.000Z	2019-09-12T06:21:27.000Z	0
UgwOReFAa0q1yAn-zT94AaABAg	黒川明人	このロケ地わかる人いますか？	このロケ地わかる人いますか？	0	2019-09-12T06:19:30.000Z	2019-09-12T06:19:30.000Z	0
Ugzp2anMbKwDJ_BdEpx4AaABAg	Oka- P	低評価じゃなくて高評価やろ〜	低評価じゃなくて高評価やろ〜	0	2019-09-12T06:19:03.000Z	2019-09-12T06:19:03.000Z	0
Ugzo_3uOEUtE1yk24054AaABAg	そふとくりーむ	日向坂にぴったりの衣装だし曲調もMVもめっちゃいい☀️ これは日向にしか作れない作品だなぁ☀️☀️	日向坂にぴったりの衣装だし曲調もMVもめっちゃいい☀️ これは日向にしか作れない作品だなぁ☀️☀️	0	2019-09-12T06:19:00.000Z	2019-09-12T06:19:00.000Z	0
UgybiOoMVsuRBmOHXpt4AaABAg	Jan Purwanto	Sarina👍👍👍	Sarina👍👍👍	0	2019-09-12T06:18:29.000Z	2019-09-12T06:18:29.000Z	0
UgxUrdq3GwOkcRI0W3J4AaABAg	けん た	表題でもいいくらい良い曲	表題でもいいくらい良い曲	0	2019-09-12T06:17:44.000Z	2019-09-12T06:17:44.000Z	0
Ugw2dEQLKQ9_r4k5PUZ4AaABAg	Oka- P	泣いてもたありがとう	泣いてもたありがとう	0	2019-09-12T06:16:58.000Z	2019-09-12T06:16:58.000Z	0
Ugyw5RPgUPj4JQoZGxV4AaABAg	dijn mssr	かわいい！！<br />幕張メッセ？？	"かわいい！！
幕張メッセ？？"	1	2019-09-12T06:14:51.000Z	2019-09-12T06:14:51.000Z	0
UgxmUzOFI7EVYycwyMR4AaABAg	せなか	曲もダンスも服装も可愛すぎるな！結局、日向坂さいこうだな！	曲もダンスも服装も可愛すぎるな！結局、日向坂さいこうだな！	0	2019-09-12T06:12:26.000Z	2019-09-12T06:12:26.000Z	0
Ugw7_HNk7g_mEgLhq-R4AaABAg	ビビルニブブ	なんだろう・・・影ちゃんが思い浮かぶ振り付けだ。	なんだろう・・・影ちゃんが思い浮かぶ振り付けだ。	0	2019-09-12T06:12:03.000Z	2019-09-12T06:12:03.000Z	0
Ugzi3nCUK0yx6P1Z3jN4AaABAg	みたらしだんご	"<a href=""https://www.youtube.com/watch?v=3ZR2_TK2lV0&amp;t=4m11s"">4:11</a> スーパーおすずきゃわタイム"	4:11 スーパーおすずきゃわタイム	0	2019-09-12T06:12:01.000Z	2019-09-12T06:12:01.000Z	0
Ugy7BBbMMXhzGLl95cN4AaABAg	みやびPrius	このちゃんが1番天使👼やろ🤗	このちゃんが1番天使👼やろ🤗	0	2019-09-12T06:11:25.000Z	2019-09-12T06:11:25.000Z	0
Ugwa4iByXPYH0OcjK1p4AaABAg	かまぼこ	鬼リピが止まらん	鬼リピが止まらん	1	2019-09-12T06:10:29.000Z	2019-09-12T06:10:29.000Z	0
UgztTyXtK-Eo9h9YA4F4AaABAg	THE CURRENT AGAINST	表題も良かったけどこれも表題でいいわ	表題も良かったけどこれも表題でいいわ	0	2019-09-12T06:10:00.000Z	2019-09-12T06:10:00.000Z	0
UgxKMtkdTTkE5q8SQCF4AaABAg	William Narita	神曲だァ	神曲だァ	0	2019-09-12T06:09:39.000Z	2019-09-12T06:09:39.000Z	0
UgxmgmIDEMmy4paRMu94AaABAg	大橋直毅	高本可愛すぎる<br />髪型も衣装も似合っててイイね！👍<br />フライングしてるところも可愛いw	"高本可愛すぎる
髪型も衣装も似合っててイイね！👍
フライングしてるところも可愛いw"	0	2019-09-12T06:07:02.000Z	2019-09-12T06:07:02.000Z	0
UgzESZ0jeBwIV_SwxC94AaABAg	カプクロ	出た！カップリングの曲が良いパターン<br /><br />キュンはときめき草<br />ドレミソラシドはMy god	"出た！カップリングの曲が良いパターン

キュンはときめき草
ドレミソラシドはMy god"	0	2019-09-12T06:06:44.000Z	2019-09-12T06:06:44.000Z	0
Ugw2m1N6XIkcr8pm3054AaABAg	上杉みち	小坂菜緒って造形美的にはすごく綺麗なわけじゃないんだけどこの集団の中ならいちばんかわいいわ	小坂菜緒って造形美的にはすごく綺麗なわけじゃないんだけどこの集団の中ならいちばんかわいいわ	1	2019-09-12T06:06:21.000Z	2019-09-12T06:06:21.000Z	0
UgyKnlXartCxV1yphfJ4AaABAg	しまりす	井口！！！！<br />日向坂辞めないでね！！！！！！	"井口！！！！
日向坂辞めないでね！！！！！！"	0	2019-09-12T06:05:07.000Z	2019-09-12T06:05:07.000Z	0
UgyVcr7uU0lB_Nifm8F4AaABAg	M H	"<a href=""https://www.youtube.com/watch?v=3ZR2_TK2lV0&amp;t=2m28s"">2:28</a><br />これって上村くんの『水玉ピンク』の振り付けでは？"	"2:28
これって上村くんの『水玉ピンク』の振り付けでは？"	0	2019-09-12T06:04:39.000Z	2019-09-12T06:04:39.000Z	0
UgxxkX1BjVAY5sHYZlp4AaABAg	しまりす	"<a href=""https://www.youtube.com/watch?v=3ZR2_TK2lV0&amp;t=1m44s"">1:44</a>  からのKAWADAさん→こさかな→おたけ が私得"	1:44  からのKAWADAさん→こさかな→おたけ が私得	0	2019-09-12T06:03:32.000Z	2019-09-12T06:03:52.000Z	0
Ugzqh5uH4-Rrfj8zlst4AaABAg	Kira	かわいい	かわいい	0	2019-09-12T06:03:20.000Z	2019-09-12T06:03:20.000Z	0
UgyzFKkeiZfDiLYeI7p4AaABAg	チャッキーo	終始の口笛はだぁれ？おすずだといいけどなぁ(〃°Д°〃)ﾃﾞｭﾌ…	終始の口笛はだぁれ？おすずだといいけどなぁ(〃°Д°〃)ﾃﾞｭﾌ…	0	2019-09-12T06:02:43.000Z	2019-09-12T06:02:43.000Z	1
UgyzFKkeiZfDiLYeI7p4AaABAg.8zljF0X46A48zllBf_EQWd	あすらら	おすずとキャプテンってコメ欄に書いてありました!	おすずとキャプテンってコメ欄に書いてありました!	0	2019-09-12T06:19:44.000Z	2019-09-12T06:19:44.000Z	0
Ugz7C_zpQGPP0l2zG2h4AaABAg	そーいちろー	おたけの髪型あたらしいな、ええやん	おたけの髪型あたらしいな、ええやん	0	2019-09-12T06:00:55.000Z	2019-09-12T06:00:55.000Z	0
Ugwe4OxSbnjqQ_LSVdl4AaABAg	na O	お願いだから、もっともっと”今”のこの日向坂（＋ひよたん影ちゃんが戻ってきてからも）でできるだけ長く色んな顔を見させてほしい。メンバー追加とかその後の後の後でいいから。この子たちの実力、可能性を見誤らないでほしい。<br /><br />スケジュール管理体調管理だけはしっかりさせて、ゆっくりでいいから、この日向坂メンバーで長く続いてほしいと思えるほど貴重なグループ。誰にも邪魔されたくない。	"お願いだから、もっともっと”今”のこの日向坂（＋ひよたん影ちゃんが戻ってきてからも）でできるだけ長く色んな顔を見させてほしい。メンバー追加とかその後の後の後でいいから。この子たちの実力、可能性を見誤らないでほしい。

スケジュール管理体調管理だけはしっかりさせて、ゆっくりでいいから、この日向坂メンバーで長く続いてほしいと思えるほど貴重なグループ。誰にも邪魔されたくない。"	0	2019-09-12T05:59:20.000Z	2019-09-12T05:59:20.000Z	0
UgwQLJBX0NYM3vvUROl4AaABAg	子役・孫悟飯	サビで楽しくなって<br />ひなの以外も肩揺れてんな。<br /><br /><br /><br /><br /><br /><br /><br /><br />良き……	"サビで楽しくなって
ひなの以外も肩揺れてんな。








良き……"	0	2019-09-12T05:58:38.000Z	2019-09-12T05:58:38.000Z	0
UgymXvE9aEyZKwNVvhF4AaABAg	蛾屋見習いなのです	こさかなをセンターに置くならこーゆー曲がとてもいいと思うのですよね	こさかなをセンターに置くならこーゆー曲がとてもいいと思うのですよね	0	2019-09-12T05:58:23.000Z	2019-09-12T05:58:23.000Z	0
Ugwi4SiyPDKMtcAL7-J4AaABAg	あい	Oh〜 <br /><br />偶然ばったり　ショッピングモールで会って<br />立ち話をした　夕暮れの手前で <br />お互いに好きな　アニメで盛り上がり<br />DVDを貸し合う　約束をしただけで<br /><br />もう、いつの間にか　街明かり付き始めて <br />頭上の空、ふと見上げる　星がパラパラって輝いた <br />そろそろ家に帰らなきゃ　なんて急に言い出して <br />腕時計をチラリ見たら　さっきから<br />１時間経ってた <br /><br />ホントの時間はどれだけ進んでたのか <br />時計なんか信用しない <br />君と過ごす時だけ時空が歪むよ <br />あっという間に過ぎる <br />だって、現国の授業中は<br />ゆっくりと針が進むし <br />もったいぶったように<br />速くなったり、遅くなったり、いい加減 <br />Oh〜 <br /><br />favoriteアニソン　一緒に口ずさみ <br />話はまだまだ　尽きなかったけれど <br /><br />もうショーウィンドウの　照明も消え始めて<br />駐車場から車が出る　残ったのは僕達だけ<br />続きはまたいつかなんて　いつもならば帰るのに <br />「ねぇ、明日も会えない？」って　何故だろう<br />１秒で聞いてた <br /><br />ホントの時間のスピードとはどれくらい？<br />今日の日付が変わるまで <br />君を想う気持ちが急がせるけれど <br />止まったように見える <br />だって、真っ暗な空の色が<br />白むにまだかかりそうだし <br />一日のその中で<br />一番遅い進み方だと思うんだ<br /><br />ねぇ、誰がネジを巻いて調節しているの？<br />一応の目安になる時間はあるだろう <br />チクタクってきっとリズム刻んでる <br />ねぇ、だけど当てにならないような針たちを<br />どうにかまとめて世界中を統一してる <br />あれこれどれも今　勝手に動き<br />速さ一定してない <br /><br />ホントの時間のスピードとはどれくらい？<br />今日の日付が変わるまで <br />君を想う気持ちが急がせるけれど<br />止まったように見える <br /><br />ホントの時間はどれだけ進んでたのか <br />時計なんか信用しない <br />君と過ごす時だけ時空が歪むよ <br />あっという間に過ぎる <br />だって、現国の授業中は<br />ゆっくりと針が進むし <br />もったいぶったように速くなったり<br />遅くなったり、いい加減 <br />Oh〜	"Oh〜 

偶然ばったり　ショッピングモールで会って
立ち話をした　夕暮れの手前で 
お互いに好きな　アニメで盛り上がり
DVDを貸し合う　約束をしただけで

もう、いつの間にか　街明かり付き始めて 
頭上の空、ふと見上げる　星がパラパラって輝いた 
そろそろ家に帰らなきゃ　なんて急に言い出して 
腕時計をチラリ見たら　さっきから
１時間経ってた 

ホントの時間はどれだけ進んでたのか 
時計なんか信用しない 
君と過ごす時だけ時空が歪むよ 
あっという間に過ぎる 
だって、現国の授業中は
ゆっくりと針が進むし 
もったいぶったように
速くなったり、遅くなったり、いい加減 
Oh〜 

favoriteアニソン　一緒に口ずさみ 
話はまだまだ　尽きなかったけれど 

もうショーウィンドウの　照明も消え始めて
駐車場から車が出る　残ったのは僕達だけ
続きはまたいつかなんて　いつもならば帰るのに 
「ねぇ、明日も会えない？」って　何故だろう
１秒で聞いてた 

ホントの時間のスピードとはどれくらい？
今日の日付が変わるまで 
君を想う気持ちが急がせるけれど 
止まったように見える 
だって、真っ暗な空の色が
白むにまだかかりそうだし 
一日のその中で
一番遅い進み方だと思うんだ

ねぇ、誰がネジを巻いて調節しているの？
一応の目安になる時間はあるだろう 
チクタクってきっとリズム刻んでる 
ねぇ、だけど当てにならないような針たちを
どうにかまとめて世界中を統一してる 
あれこれどれも今　勝手に動き
速さ一定してない 

ホントの時間のスピードとはどれくらい？
今日の日付が変わるまで 
君を想う気持ちが急がせるけれど
止まったように見える 

ホントの時間はどれだけ進んでたのか 
時計なんか信用しない 
君と過ごす時だけ時空が歪むよ 
あっという間に過ぎる 
だって、現国の授業中は
ゆっくりと針が進むし 
もったいぶったように速くなったり
遅くなったり、いい加減 
Oh〜"	0	2019-09-12T05:58:07.000Z	2019-09-12T05:58:07.000Z	0
UgyknjSh4ZRtO2aO2At4AaABAg	発明家ライトン	こんな最高なMV観たんだ。<br />明日から頑張るしかねぇので。	"こんな最高なMV観たんだ。
明日から頑張るしかねぇので。"	0	2019-09-12T05:57:46.000Z	2019-09-12T05:57:46.000Z	0
UgxrGyIcAHLHJITa0WV4AaABAg	Kirezin Girta	これ幕張だよね？！？！<br />米津さんのライブで見た景色にそっくり！！	"これ幕張だよね？！？！
米津さんのライブで見た景色にそっくり！！"	0	2019-09-12T05:57:41.000Z	2019-09-12T05:57:41.000Z	0
Ugw1lFGQ6zh8UKF1Ogp4AaABAg	こうき	"<a href=""https://www.youtube.com/watch?v=3ZR2_TK2lV0&amp;t=0m48s"">0:48</a><br />地味に間違えるめいめい"	"0:48
地味に間違えるめいめい"	0	2019-09-12T05:57:29.000Z	2019-09-12T05:57:29.000Z	0
UgwtKqup6pOczbTdECd4AaABAg	rahiem abdul	Freshhhhh 🍋🍋🍋	Freshhhhh 🍋🍋🍋	0	2019-09-12T05:56:49.000Z	2019-09-12T05:56:49.000Z	0
UgyCG8QVhuctdCFA6b14AaABAg	あーこ	shortにするなよ？！<br /><br />上からですいませんshortにしないでください運営様	"shortにするなよ？！

上からですいませんshortにしないでください運営様"	1	2019-09-12T05:56:40.000Z	2019-09-12T05:56:40.000Z	0
Ugw6KXXdS_yfRxlZKo14AaABAg	かな	あゃめぃちゃんの前にはメンバーがいないから実際私だけフロントだと思ってる🙈	あゃめぃちゃんの前にはメンバーがいないから実際私だけフロントだと思ってる🙈	0	2019-09-12T05:54:44.000Z	2019-09-12T05:54:44.000Z	0
UgzdxxzunFPqRhbCQcp4AaABAg	BIRD MAN	わくわくピーナッツいいね！👍	わくわくピーナッツいいね！👍	0	2019-09-12T05:54:26.000Z	2019-09-12T05:54:26.000Z	1
UgzdxxzunFPqRhbCQcp4AaABAg.8zliINQfD5H8zllHl4JC8z	あすらら	ゴリドーも笑	ゴリドーも笑	0	2019-09-12T06:20:34.000Z	2019-09-12T06:20:34.000Z	0
UgwKJXb4WYg-PwLnziN4AaABAg	Mew no Himitsu	You can watch this outside Japan. Hurray!!	You can watch this outside Japan. Hurray!!	0	2019-09-12T05:53:45.000Z	2019-09-12T05:53:45.000Z	0
UgymKVKAI3b4vj86WXx4AaABAg	カメレオン	幕張やん	幕張やん	0	2019-09-12T05:53:28.000Z	2019-09-12T05:53:28.000Z	0
Ugzo_50a_TcLAiNEy_94AaABAg	とうとうとうとう	良いね❗👍この曲‼️<br />服装可愛すぎ　日向っぽいね	"良いね❗👍この曲‼️
服装可愛すぎ　日向っぽいね"	0	2019-09-12T05:53:25.000Z	2019-09-12T05:53:25.000Z	0
UgwfsJJ18rynkspDqLl4AaABAg	あすらら	衣装も雰囲気も可愛い💓日向坂らしい！	衣装も雰囲気も可愛い💓日向坂らしい！	0	2019-09-12T05:52:51.000Z	2019-09-12T05:52:51.000Z	0
UgwYN4CBvSOx-uJxOmd4AaABAg	村田ゆーり	ま、まなもぉぉぉぉぉ！好き！<br /><br />口笛のところどうぶつの森みたい	"ま、まなもぉぉぉぉぉ！好き！

口笛のところどうぶつの森みたい"	0	2019-09-12T05:52:40.000Z	2019-09-12T05:52:40.000Z	0
Ugz2tw-3fmSU9cu3cq14AaABAg	BIRD MAN	日向坂でしか味わえないこのワクワク感たまらんぜ！	日向坂でしか味わえないこのワクワク感たまらんぜ！	0	2019-09-12T05:52:21.000Z	2019-09-12T05:52:21.000Z	0
