id	author	text	raw_text	likes	published_at	updated_at	num_replies
Ugwe5Elhvn0TZWc3n4l4AaABAg	サザンライナー	久美ちゃんとおたけ、スタイル抜群。	久美ちゃんとおたけ、スタイル抜群。	3	2019-09-22T03:14:14.000Z	2019-09-22T03:14:14.000Z	0
UgzRyDlszvOPJ53r7Kp4AaABAg	だーまー	潮紗理菜推しとしては初のMVありのユニットで嬉しい😊	潮紗理菜推しとしては初のMVありのユニットで嬉しい😊	1	2019-09-22T03:14:08.000Z	2019-09-22T03:14:08.000Z	0
UgyTa4adTbYsChAgVk94AaABAg	平	初期のひらがなを支えた主力メンバーはやっぱ強すぎ	初期のひらがなを支えた主力メンバーはやっぱ強すぎ	24	2019-09-22T03:14:00.000Z	2019-09-22T03:14:00.000Z	0
UgyKD_Fa-siS5QRLnGB4AaABAg	平手友梨奈	おたけ、可愛い(* ॑꒳ ॑*)	おたけ、可愛い(* ॑꒳ ॑*)	0	2019-09-22T03:14:00.000Z	2019-09-22T03:14:00.000Z	0
UgyRBlyydfYda05JpAl4AaABAg	かる	開始から可愛すぎてやられた	開始から可愛すぎてやられた	0	2019-09-22T03:13:59.000Z	2019-09-22T03:13:59.000Z	0
UgzdSdJ3U9JoevZuMDd4AaABAg	I love Tetra	あーおたけなんだよなぁ	あーおたけなんだよなぁ	0	2019-09-22T03:13:53.000Z	2019-09-22T03:13:53.000Z	0
UgyXN944G9OXH-WbCc94AaABAg	千葉の坂道ファン	りまちゃんちっく最高です！としちゃんセンターめちゃ嬉しい！<br /><br /><br /><br /><br />運営さん、3rdも神すぎるんで、shortにしないでください･･･。	"りまちゃんちっく最高です！としちゃんセンターめちゃ嬉しい！




運営さん、3rdも神すぎるんで、shortにしないでください･･･。"	0	2019-09-22T03:13:51.000Z	2019-09-22T03:18:17.000Z	0
Ugzcwp2fJuhOeI9BftR4AaABAg	愛理河田	みんな可愛すぎる💓<br />大好きすぎる😘	"みんな可愛すぎる💓
大好きすぎる😘"	0	2019-09-22T03:13:49.000Z	2019-09-22T03:13:49.000Z	0
UgyJnRwZG7tjYa6pjDR4AaABAg	キューバのホセ大佐	ささく脚長すぎじゃん笑	ささく脚長すぎじゃん笑	1	2019-09-22T03:13:46.000Z	2019-09-22T03:13:46.000Z	0
UgwJzaDLspc-8zCHa254AaABAg	ちゃんmi	これまじで何か飲料のCM出来そう……映像が眩しい……！	これまじで何か飲料のCM出来そう……映像が眩しい……！	1	2019-09-22T03:13:39.000Z	2019-09-22T03:13:39.000Z	0
UgzjVmcRAgxqm4T5peJ4AaABAg	表デルヤ	聖地巡礼の場所多くなりそう	聖地巡礼の場所多くなりそう	1	2019-09-22T03:13:27.000Z	2019-09-22T03:13:27.000Z	0
UgwU_AO0V3JPIGTgZ794AaABAg	てちとすずもん	えーー！12分前なのにもう1万回再生！👏🏼	えーー！12分前なのにもう1万回再生！👏🏼	0	2019-09-22T03:13:25.000Z	2019-09-22T03:13:25.000Z	0
UgxIj9YES6Iycgt-Cdp4AaABAg	山野理美	かとし<br />好きな人✋ヾ(*´Д｀*)ノﾊｰｲ	"かとし
好きな人✋ヾ(*´Д｀*)ノﾊｰｲ"	12	2019-09-22T03:13:23.000Z	2019-09-22T03:13:23.000Z	0
Ugzg5wwmNU-xMFf4h9V4AaABAg	KAWS	かわいい！	かわいい！	0	2019-09-22T03:13:22.000Z	2019-09-22T03:13:22.000Z	0
UgzbuzvnUm2_XUSzCIZ4AaABAg	えす	安心、安定のメンバー<br />フツーにええ曲	"安心、安定のメンバー
フツーにええ曲"	1	2019-09-22T03:13:17.000Z	2019-09-22T03:13:17.000Z	0
Ugy8BIXE2lUVEMVeifx4AaABAg	は〜と	圧倒的、りまちゃんちっく。	圧倒的、りまちゃんちっく。	1	2019-09-22T03:13:17.000Z	2019-09-22T03:13:17.000Z	0
UgxDadpKjohkR6y8vex4AaABAg	こうちゃんねる	としちゃんのポニテが最高すぎてもう課題やるしかねぇのでやります	としちゃんのポニテが最高すぎてもう課題やるしかねぇのでやります	1	2019-09-22T03:13:16.000Z	2019-09-22T03:13:16.000Z	0
UgzHLY1_M7jir-WbqJp4AaABAg	驪黐	としちゃんから始まるんですねかわいい〜〜👼🏼‪‪❤︎‬	としちゃんから始まるんですねかわいい〜〜👼🏼‪‪❤︎‬	38	2019-09-22T03:13:15.000Z	2019-09-22T03:13:15.000Z	0
UgxonmgzxMwEb6U_9CJ4AaABAg	齋藤飛鳥可愛いbot	これを見るのはエンドレス	これを見るのはエンドレス	0	2019-09-22T03:13:10.000Z	2019-09-22T03:13:10.000Z	0
UgzP4sntZmu2usM2A2B4AaABAg	永遠のてちめみ推し	1万回行くまでに見れた人✋	1万回行くまでに見れた人✋	1	2019-09-22T03:13:01.000Z	2019-09-22T03:13:01.000Z	0
UgyFhCyYl7kWk9mNytJ4AaABAg	みう.。*	久美ちゃん可愛いすぎる 〜〜 ！！︎︎︎❤︎	久美ちゃん可愛いすぎる 〜〜 ！！︎︎︎❤︎	5	2019-09-22T03:12:59.000Z	2019-09-22T03:12:59.000Z	0
UgwmZXYvw-skXEQJenB4AaABAg	ゆめ	かとしいつにも増してかわいくない？！メンバー最高💖💖	かとしいつにも増してかわいくない？！メンバー最高💖💖	2	2019-09-22T03:12:58.000Z	2019-09-22T03:13:24.000Z	0
UgwpI1VJHsrY9axEjeJ4AaABAg	ゆかめみ	なっちょ可愛すぎ	なっちょ可愛すぎ	1	2019-09-22T03:12:56.000Z	2019-09-22T03:12:56.000Z	0
UgwIDQuKcraKufZy-N54AaABAg	テンアキト	"<a href=""https://www.youtube.com/watch?v=H3hMF9fs1IA&amp;t=1m59s"">1:59</a> このきょんこ好きすぎる"	1:59 このきょんこ好きすぎる	1	2019-09-22T03:12:53.000Z	2019-09-22T03:12:53.000Z	0
Ugw9bDne46FnoBjxNoN4AaABAg	かはる	うしおさりなちゃんもっと見つかってほしい	うしおさりなちゃんもっと見つかってほしい	1	2019-09-22T03:12:51.000Z	2019-09-22T03:12:51.000Z	0
UgxizeIPRAfnh_jMAwh4AaABAg	そらまめ	きょんこが勉強してるだと！？	きょんこが勉強してるだと！？	0	2019-09-22T03:12:49.000Z	2019-09-22T03:12:49.000Z	0
Ugz6reNbJWciP1KpXkp4AaABAg	56::/56 34-:68	通知きて速攻とんできた人！<br />↓↓	"通知きて速攻とんできた人！
↓↓"	1	2019-09-22T03:12:38.000Z	2019-09-22T03:12:38.000Z	0
Ugy9kK6BAap2FfZ1ZYZ4AaABAg	朝から晩までひらがな推し	名古屋全握いる人🙋‍♂️	名古屋全握いる人🙋‍♂️	0	2019-09-22T03:12:30.000Z	2019-09-22T03:12:30.000Z	0
UgwFgQnROoyAZKTaQmd4AaABAg	ぼたもち	おたけのスタイルやばいようあこがれ	おたけのスタイルやばいようあこがれ	0	2019-09-22T03:12:28.000Z	2019-09-22T03:12:28.000Z	0
UgzD6U44ZKtlM7TJ8214AaABAg	1日陰穴	なっちょはむしろママなんですけどもね	なっちょはむしろママなんですけどもね	0	2019-09-22T03:12:28.000Z	2019-09-22T03:12:28.000Z	0
UgxlJFOSURwj-a4K2lp4AaABAg	king stone	としちゃーん！	としちゃーん！	1	2019-09-22T03:12:27.000Z	2019-09-22T03:12:27.000Z	0
UgweeNPNdPKPImL_HWF4AaABAg	アセスルファムカリウム	この手の曲調無限に聞ける	この手の曲調無限に聞ける	0	2019-09-22T03:12:21.000Z	2019-09-22T03:12:21.000Z	0
UgwJEsp7LkEoia1L3d54AaABAg	朝から晩までひらがな推し	りまちゃちっくしか勝たん！！！！！	りまちゃちっくしか勝たん！！！！！	0	2019-09-22T03:12:19.000Z	2019-09-22T03:12:19.000Z	0
UgyGAQ_TOWjdM0VAWZ94AaABAg	大久保利通	みんな可愛い(直球)	みんな可愛い(直球)	1	2019-09-22T03:12:18.000Z	2019-09-22T03:12:18.000Z	0
Ugz43NhJ2KueT_oKzFB4AaABAg	ホノカ00	あ、すこ	あ、すこ	0	2019-09-22T03:12:05.000Z	2019-09-22T03:12:05.000Z	0
Ugz_apZEejqC2HU0bxJ4AaABAg	Hina	りまちゃんちっく最高すぎ<br />みんなかわいい、、	"りまちゃんちっく最高すぎ
みんなかわいい、、"	7	2019-09-22T03:12:02.000Z	2019-09-22T03:12:02.000Z	0
UgxkGNoxm5jIfqZGr8V4AaABAg	Mai W	最近曲いっぱい出してくれて嬉しい！！	最近曲いっぱい出してくれて嬉しい！！	0	2019-09-22T03:12:01.000Z	2019-09-22T03:12:01.000Z	0
UgzEP62D3Hx-GlYCRlt4AaABAg	ちぎりん	うしおの声笑	うしおの声笑	0	2019-09-22T03:11:56.000Z	2019-09-22T03:11:56.000Z	0
UgwD-4qS5k6c7DmKjKJ4AaABAg	パンク春日	トゥルトゥトゥトゥのとこすし	トゥルトゥトゥトゥのとこすし	0	2019-09-22T03:11:53.000Z	2019-09-22T03:11:53.000Z	0
Ugz4vvQol1KVY6YE70F4AaABAg	ぼたもち	まかしーのパートをshortにはさせないぞ	まかしーのパートをshortにはさせないぞ	0	2019-09-22T03:11:42.000Z	2019-09-22T03:11:42.000Z	0
UgxcKkid_osMVLJt99l4AaABAg	ASMRそら	最初のかとしのところディズニー感半端ない（伝われ）	最初のかとしのところディズニー感半端ない（伝われ）	2	2019-09-22T03:11:42.000Z	2019-09-22T03:11:42.000Z	0
Ugyrd-Dphq5jFOZGezZ4AaABAg	time is getting on	ハッピーオーラ！	ハッピーオーラ！	0	2019-09-22T03:11:36.000Z	2019-09-22T03:11:36.000Z	0
Ugz917inXcfCorWaTwt4AaABAg	MrMakuprime	曲急に増えてついていけない笑	曲急に増えてついていけない笑	0	2019-09-22T03:11:28.000Z	2019-09-22T03:11:28.000Z	0
UgyAiBrGM0_jh3ZcEoN4AaABAg	SuperQtaro	久美ちゃんと自転車二人乗りしたい	久美ちゃんと自転車二人乗りしたい	2	2019-09-22T03:11:19.000Z	2019-09-22T03:11:19.000Z	0
Ugy1PsS7ewoahyJn9XZ4AaABAg	LIFEバイソン	みんな可愛すぎ✨	みんな可愛すぎ✨	0	2019-09-22T03:11:18.000Z	2019-09-22T03:11:18.000Z	0
UgyhgVRacgbVJfpmgmd4AaABAg	合同動画坂道	きょんこの可愛さにやられた	きょんこの可愛さにやられた	3	2019-09-22T03:11:16.000Z	2019-09-22T03:11:16.000Z	0
UgygVsjSY-CdmMKzTm54AaABAg	。。	あわよくば沈黙した恋人よのMV欲しい…	あわよくば沈黙した恋人よのMV欲しい…	587	2019-09-22T03:11:15.000Z	2019-09-22T03:11:15.000Z	16
UgygVsjSY-CdmMKzTm54AaABAg.9-AAZvcULMb9-BLGrW9HZJ	福田愛菜	あわよくば井口のサクランボカバーしたやつのMV欲しい！	あわよくば井口のサクランボカバーしたやつのMV欲しい！	0	2019-09-22T14:04:00.000Z	2019-09-22T14:04:00.000Z	0
UgygVsjSY-CdmMKzTm54AaABAg.9-AAZvcULMb9-BGhYATE6X	長谷川悦夫	@清楚今日から 右に同じくです	@清楚今日から 右に同じくです	0	2019-09-22T13:24:05.000Z	2019-09-22T13:24:05.000Z	0
UgygVsjSY-CdmMKzTm54AaABAg.9-AAZvcULMb9-BGV9cp6eM	あ あ	あわよくば松田このと水族館デート行きたい…	あわよくば松田このと水族館デート行きたい…	0	2019-09-22T13:22:16.000Z	2019-09-22T13:22:16.000Z	0
UgygVsjSY-CdmMKzTm54AaABAg.9-AAZvcULMb9-BB-krVoGA	清楚今日から	あわよくば休止中メンバーと柿崎とねるを入れた完全体けやき坂46を見たい	あわよくば休止中メンバーと柿崎とねるを入れた完全体けやき坂46を見たい	6	2019-09-22T12:34:17.000Z	2019-09-22T12:34:17.000Z	0
UgygVsjSY-CdmMKzTm54AaABAg.9-AAZvcULMb9-BA2kcHmH3	公務員おひさま	あわよくば21人完全無欠の日向坂を一夜でいいから見たい人生だった	あわよくば21人完全無欠の日向坂を一夜でいいから見たい人生だった	3	2019-09-22T12:25:57.000Z	2019-09-22T12:25:57.000Z	0
UgwaBDFUcFyRYJZokIh4AaABAg	筋肉いっぱい	振り付けが今回もかわいいです	振り付けが今回もかわいいです	1	2019-09-22T03:11:13.000Z	2019-09-22T03:11:13.000Z	0
Ugyn7A4Rsy6AqzSD5ot4AaABAg	渡辺梨加一生応援	やだかわいい！！！！！	やだかわいい！！！！！	0	2019-09-22T03:11:10.000Z	2019-09-22T03:11:10.000Z	0
Ugx_2Y60RXktKZBIVId4AaABAg	ロジオン・ロマーヌイチラスコーリニコフ	うしおさ、りな！が覚醒してる！	うしおさ、りな！が覚醒してる！	0	2019-09-22T03:11:10.000Z	2019-09-22T03:11:10.000Z	0
UgzsyvZp_JJx48evrwZ4AaABAg	matu nasu	聞いたら凄きハッピーになりますた	聞いたら凄きハッピーになりますた	0	2019-09-22T03:11:06.000Z	2019-09-22T03:11:06.000Z	0
UgwWe2FrcVk_H9abKUF4AaABAg	坂コマ	可愛いー<br />振り付けも日向っぽくていいわぁ<br />1期だけっていうのもやっぱいいな。<br />かとしセンターおめでとう🎊	"可愛いー
振り付けも日向っぽくていいわぁ
1期だけっていうのもやっぱいいな。
かとしセンターおめでとう🎊"	311	2019-09-22T03:10:57.000Z	2019-09-22T03:10:57.000Z	0
UgwWJte4e_fGnV1HZZJ4AaABAg	平野紫耀	なにこのハッピーオーラ全開の曲！最高	なにこのハッピーオーラ全開の曲！最高	5	2019-09-22T03:10:57.000Z	2019-09-22T03:10:57.000Z	0
Ugwp8qTNcMZyxiuN6Hh4AaABAg	洋冲災	まさかシティ・ポップに寄せてくるとはりまちゃんちっく恐ろしいな…	まさかシティ・ポップに寄せてくるとはりまちゃんちっく恐ろしいな…	9	2019-09-22T03:10:55.000Z	2019-09-22T03:10:55.000Z	0
Ugxtl4emAOJQx3CYAol4AaABAg	テンアキト	きょんこの歌声がもちろん素敵だけど、女の子っぽい声の中から聴こえてくるのがもっといいね	きょんこの歌声がもちろん素敵だけど、女の子っぽい声の中から聴こえてくるのがもっといいね	1	2019-09-22T03:10:55.000Z	2019-09-22T03:10:55.000Z	0
UgyyD_9PNW-5g3hoPAF4AaABAg	アスパラアスパラ	クリスマスの夜に聞くことに決めた	クリスマスの夜に聞くことに決めた	0	2019-09-22T03:10:50.000Z	2019-09-22T03:10:50.000Z	0
Ugw09555tCv-CJFEwZ14AaABAg	Y冬真	なっちょくっそかわいい❤️	なっちょくっそかわいい❤️	0	2019-09-22T03:10:31.000Z	2019-09-22T03:10:31.000Z	0
UgwkNUwIB5TCZ7QCmvB4AaABAg	ぽてぽてぽてりこ	とりあえず、としちゃんが可愛い❤❤❤❤❤	とりあえず、としちゃんが可愛い❤❤❤❤❤	1	2019-09-22T03:10:31.000Z	2019-09-22T03:10:31.000Z	0
UgxmmtEYJ3mtF890Zh94AaABAg	angle	彩ちゃんかわいい〜！！！<br />りまちゃんちっく最高😍😍💗	"彩ちゃんかわいい〜！！！
りまちゃんちっく最高😍😍💗"	1	2019-09-22T03:10:27.000Z	2019-09-22T03:10:27.000Z	0
UgzAuBtYmQ-3rnqxBDZ4AaABAg	mano	あやちゃんのツインテかわいすぎる🥺	あやちゃんのツインテかわいすぎる🥺	0	2019-09-22T03:10:23.000Z	2019-09-22T03:10:23.000Z	0
Ugx0UB5Ynq0OlCGMae54AaABAg	ひなたざか推し	みんな可愛すぎでしょ！	みんな可愛すぎでしょ！	0	2019-09-22T03:10:23.000Z	2019-09-22T03:10:23.000Z	0
UgxEwaMR9-sP9_wa5Wp4AaABAg	すし太郎2000	ハロウィンのカボチャが割れたと<br />ママのドレスこの二曲たまアリでやってほしいですねぇ…<br />いや、やるしかねぇので	"ハロウィンのカボチャが割れたと
ママのドレスこの二曲たまアリでやってほしいですねぇ…
いや、やるしかねぇので"	0	2019-09-22T03:10:17.000Z	2019-09-22T03:10:17.000Z	0
Ugypr8LQkWWOdVnnrHB4AaABAg	2525っw g	ヤバい❗かとしのポニーテール可愛すぎる❗	ヤバい❗かとしのポニーテール可愛すぎる❗	81	2019-09-22T03:10:16.000Z	2019-09-22T03:10:16.000Z	0
Ugxh7Y1wtoJbXreCxb54AaABAg	しろぶ。	全員ブサイクで音痴やなぁ～wwwww<br />オタクはこんな人達に貢ぐんじゃなくて、千葉県に全額寄付しろよ(  ｰ̀дｰ́ )	"全員ブサイクで音痴やなぁ～wwwww
オタクはこんな人達に貢ぐんじゃなくて、千葉県に全額寄付しろよ(  ｰ̀дｰ́ )"	0	2019-09-22T03:10:15.000Z	2019-09-22T03:10:15.000Z	0
Ugy88jL8tkNIv0AYr294AaABAg	えり	あやちゃんのツインテ最強！！	あやちゃんのツインテ最強！！	0	2019-09-22T03:10:13.000Z	2019-09-22T03:10:13.000Z	0
UgyMJMSgJK7KZTfFMqt4AaABAg	飛鳥しか〜	みんな可愛すぎだろー！	みんな可愛すぎだろー！	0	2019-09-22T03:10:12.000Z	2019-09-22T03:10:12.000Z	0
UgzAMFUC-T7o61qZ5Px4AaABAg	んがもも	きょんこユニット意外と珍しい 逆にかとし毎回あるよな	きょんこユニット意外と珍しい 逆にかとし毎回あるよな	0	2019-09-22T03:10:11.000Z	2019-09-22T03:10:11.000Z	0
UgzOZstaWHykVXX-Wah4AaABAg	もも	りまちゃんちっく楽曲は正直どれも神曲だけどまた神曲〜〜〜〜！！！サビ前最高すぎる（ ;  ; ）（ ;  ; ）	りまちゃんちっく楽曲は正直どれも神曲だけどまた神曲〜〜〜〜！！！サビ前最高すぎる（ ;  ; ）（ ;  ; ）	8	2019-09-22T03:10:09.000Z	2019-09-22T03:10:09.000Z	0
UgyWDmLDGcVgPLBMyRp4AaABAg	city osam	メイキャップルーム♫化粧する場所♫	メイキャップルーム♫化粧する場所♫	0	2019-09-22T03:10:08.000Z	2019-09-22T03:10:08.000Z	0
Ugw7NxDpM4y87CeOJrp4AaABAg	っかまり	潮の声すき	潮の声すき	0	2019-09-22T03:10:07.000Z	2019-09-22T03:10:07.000Z	0
UgyJqTzFCwyawBc-xZ94AaABAg	たーちす	日向坂初心者なんですけど、どうやって、りまちゃんちっくってユニットの名前になったんですか？	日向坂初心者なんですけど、どうやって、りまちゃんちっくってユニットの名前になったんですか？	26	2019-09-22T03:10:05.000Z	2019-09-22T03:10:41.000Z	3
UgyJqTzFCwyawBc-xZ94AaABAg.9-AARL8eAWy9-AryooAj8W	nog666	@わかめわかめ 質問した人じゃないですけど横から頂きました！ありがトゥース☝️	@わかめわかめ 質問した人じゃないですけど横から頂きました！ありがトゥース☝️	3	2019-09-22T09:39:15.000Z	2019-09-22T09:39:15.000Z	0
UgyJqTzFCwyawBc-xZ94AaABAg.9-AARL8eAWy9-AFMO3Zd13	わかめわかめ	〜ユニット名が決まるまで〜<br /><br />⚪:5人だから。5を入れたいね…<br />⚪:ふぁいぶ!!<br />⚪:あ、でもFIVE CARDSさんが<br />いらっしゃる！！<br /><br />⚪:じゃあ、ご!!<br /><br />⚪:え？笑<br /><br />⚪:うーん。<br />⚪:どうしよう…<br /><br />こんな感じの会話が続き…<br /><br />⚪:あ、ちなみにインドネシア語で<br />5はリマだよ〜!!<br /><br />と言ったところリマが採用<br />されました!!<br /><br />でもリマだけじゃ寂しいよね…<br />ってことで<br /><br />5人の共通点を探したのですが<br />なかなか難しくて<br /><br />じゃあ英単語がなにかで<br />目標つけてみる！？<br />となり <br />またいろいろ候補が出てきたものの<br /><br />⚪:キラリま！<br /><br />⚪:え、まって英語じゃないじゃん！笑<br /><br />みたいな会話になり<br /><br />りまcuteと誰かが出してくれたので<br /><br />⚪:あ！ちなみにインドネシア語で<br />かわいいはチャンティックだよ〜！！<br /><br />と言ったところ<br />りまちゃんてぃっく<br />という名前が出来ました。<br /><br />他にもいくつか最終まで<br />残ったものがあって その中から<br />多数決でりまちゃんちっくに<br />決まりました!!<br /><br />ものすごく簡単にまとめると<br />こうしてユニット名が誕生しました。<br /><br />リマ→5<br />チャンティック→かわいい<br /><br />でも、目標であり<br />まだなりきれていないので<br />あえてチャンティックではなく<br />チャンチック。にしました。<br /><br />それからひらがなけやきと<br />いうことで 全部ひらがなにして<br /><br /><br />りまちゃんちっく。<br /><br /><br />です！！<br /><br /><br /><br /><br />こんな感じらしいです！<br />これは2017年7月13日の潮 紗理菜<br />ちゃんのブログそのまんまです笑<br />ご参考になれば…✨	"〜ユニット名が決まるまで〜

⚪:5人だから。5を入れたいね…
⚪:ふぁいぶ!!
⚪:あ、でもFIVE CARDSさんが
いらっしゃる！！

⚪:じゃあ、ご!!

⚪:え？笑

⚪:うーん。
⚪:どうしよう…

こんな感じの会話が続き…

⚪:あ、ちなみにインドネシア語で
5はリマだよ〜!!

と言ったところリマが採用
されました!!

でもリマだけじゃ寂しいよね…
ってことで

5人の共通点を探したのですが
なかなか難しくて

じゃあ英単語がなにかで
目標つけてみる！？
となり 
またいろいろ候補が出てきたものの

⚪:キラリま！

⚪:え、まって英語じゃないじゃん！笑

みたいな会話になり

りまcuteと誰かが出してくれたので

⚪:あ！ちなみにインドネシア語で
かわいいはチャンティックだよ〜！！

と言ったところ
りまちゃんてぃっく
という名前が出来ました。

他にもいくつか最終まで
残ったものがあって その中から
多数決でりまちゃんちっくに
決まりました!!

ものすごく簡単にまとめると
こうしてユニット名が誕生しました。

リマ→5
チャンティック→かわいい

でも、目標であり
まだなりきれていないので
あえてチャンティックではなく
チャンチック。にしました。

それからひらがなけやきと
いうことで 全部ひらがなにして


りまちゃんちっく。


です！！




こんな感じらしいです！
これは2017年7月13日の潮 紗理菜
ちゃんのブログそのまんまです笑
ご参考になれば…✨"	46	2019-09-22T03:53:05.000Z	2019-09-22T03:53:05.000Z	0
UgyJqTzFCwyawBc-xZ94AaABAg.9-AARL8eAWy9-AEi5Lupsn	1%のねるで出来てる99%の日向坂と	"なっちょさんのブログに書いてあります　<a href=""https://www.hinatazaka46.com/s/official/diary/detail/22971"">https://www.hinatazaka46.com/s/official/diary/detail/22971</a>"	なっちょさんのブログに書いてあります　https://www.hinatazaka46.com/s/official/diary/detail/22971	8	2019-09-22T03:47:27.000Z	2019-09-22T03:47:27.000Z	0
UgwDm0VE-6do40xwqp54AaABAg	べべっべ	かとしとなっちょの歌声(高)<br />きょんこおたけささく(低)<br />ちょうどいいわ〜	"かとしとなっちょの歌声(高)
きょんこおたけささく(低)
ちょうどいいわ〜"	100	2019-09-22T03:09:59.000Z	2019-09-22T03:09:59.000Z	0
Ugy7TtbfyMsZ1ocjnmt4AaABAg	りりんぬ	今日の握手会行きたかったけど行けなくて萎えてたけどPV早く見れたから満足！<br /><br />あああ、みんな可愛すぎる	"今日の握手会行きたかったけど行けなくて萎えてたけどPV早く見れたから満足！

あああ、みんな可愛すぎる"	0	2019-09-22T03:09:51.000Z	2019-09-22T03:09:51.000Z	0
UgwhTz9KQcruNb_bhn14AaABAg	Brack0425	今のままでも十分なのにどんどん進化し続けるグループ	今のままでも十分なのにどんどん進化し続けるグループ	0	2019-09-22T03:09:50.000Z	2019-09-22T03:09:50.000Z	0
Ugw2RnVXpht6vggLW8d4AaABAg	こなー	りまちゃんちっくの皆さん、おたけとても良いMVでした!	りまちゃんちっくの皆さん、おたけとても良いMVでした!	0	2019-09-22T03:09:49.000Z	2019-09-22T03:09:49.000Z	0
UgwvOYMDosDWaatEOGd4AaABAg	椎名龍人	加藤史帆センターおめでとう	加藤史帆センターおめでとう	1	2019-09-22T03:09:44.000Z	2019-09-22T03:09:44.000Z	0
Ugx5m1oqKxmIels4a0h4AaABAg	バスケ24	漂うけやき坂感	漂うけやき坂感	1	2019-09-22T03:09:39.000Z	2019-09-22T03:09:39.000Z	0
UgzdTSkq-ge6CZzs0LN4AaABAg	高本タオル	おたけツインテール可愛すぎーーー！	おたけツインテール可愛すぎーーー！	0	2019-09-22T03:09:34.000Z	2019-09-22T03:09:34.000Z	0
UgwmIVpzwAp6gYJTJRV4AaABAg	能熊	お姉さんユニットも最高だけど妹のユニットも見たいです。運営さん	お姉さんユニットも最高だけど妹のユニットも見たいです。運営さん	1	2019-09-22T03:09:28.000Z	2019-09-22T03:09:28.000Z	0
UgzIAUK8-3EtoAHgVhF4AaABAg	S a	"<a href=""https://www.youtube.com/watch?v=H3hMF9fs1IA&amp;t=0m59s"">0:59</a>~ 彼氏が迎えに来たってとこのおたけが可愛すぎる、、"	0:59~ 彼氏が迎えに来たってとこのおたけが可愛すぎる、、	0	2019-09-22T03:09:25.000Z	2019-09-22T03:09:25.000Z	0
UgzLlBXw1BcOl9l0lg94AaABAg	日向坂46をもっと広め隊 隊長	2期生強いって言われがちやけど、やっぱり俺は1期生が大好き（もちろんみんな大好き)	2期生強いって言われがちやけど、やっぱり俺は1期生が大好き（もちろんみんな大好き)	778	2019-09-22T03:09:19.000Z	2019-09-22T04:14:28.000Z	15
UgzLlBXw1BcOl9l0lg94AaABAg.9-AALlcCBrq9-BIOBlNbsm	るかー	とりあえず塩化カリウムで人殺すなよ	とりあえず塩化カリウムで人殺すなよ	0	2019-09-22T13:38:47.000Z	2019-09-22T13:38:47.000Z	0
UgzLlBXw1BcOl9l0lg94AaABAg.9-AALlcCBrq9-B3rujJuua	ぽるた_poruta	なるほど、その手があったか…	なるほど、その手があったか…	0	2019-09-22T11:31:55.000Z	2019-09-22T11:31:55.000Z	0
UgzLlBXw1BcOl9l0lg94AaABAg.9-AALlcCBrq9-B3eDVWxD0	_えび	希塩酸って書けや	希塩酸って書けや	1	2019-09-22T11:30:02.000Z	2019-09-22T11:30:02.000Z	0
UgzLlBXw1BcOl9l0lg94AaABAg.9-AALlcCBrq9-B1LxxY_QM	テスト	ぽるた_poruta 炭酸水素ナトリウムは草	ぽるた_poruta 炭酸水素ナトリウムは草	2	2019-09-22T11:09:56.000Z	2019-09-22T11:09:56.000Z	0
UgzLlBXw1BcOl9l0lg94AaABAg.9-AALlcCBrq9-B0NMeZp2d	ぽるた_poruta	確かに冷めるコメだけれどもな、責めすぎるのはお門違いだからほどほどにな。<br />薄い塩酸だか炭酸水素ナトリウムかなんだか知らんが同じ日向坂を見にきた仲間なんだから次からはしっかり考えてコメしような。	"確かに冷めるコメだけれどもな、責めすぎるのはお門違いだからほどほどにな。
薄い塩酸だか炭酸水素ナトリウムかなんだか知らんが同じ日向坂を見にきた仲間なんだから次からはしっかり考えてコメしような。"	1	2019-09-22T11:01:23.000Z	2019-09-22T11:02:03.000Z	0
