id	author	text	raw_text	likes	published_at	updated_at	num_replies
UgwanxxxlHj9diJoubt4AaABAg	ゆーき	べみほの歌が何気に頭に残るんだが笑	べみほの歌が何気に頭に残るんだが笑	1	2019-10-01T17:10:17.000Z	2019-10-01T17:10:17.000Z	0
Ugxkv7G5jxQYc87AwMp4AaABAg	過去にもどりたい	いやまじでみんな可愛いの一言に尽きるわ	いやまじでみんな可愛いの一言に尽きるわ	2	2019-10-01T16:32:25.000Z	2019-10-01T16:32:25.000Z	0
Ugxz7XqVLJ6InxNRPmt4AaABAg	ブロッコリー	"<a href=""https://www.youtube.com/watch?v=_iyCAzClmT8&amp;t=1m43s"">1:43</a>クソワロタww"	1:43クソワロタww	1	2019-10-01T15:57:52.000Z	2019-10-01T15:57:52.000Z	0
UgwmFqr0__CxgKWsP0B4AaABAg	日向坂こんこん	急上昇おめ！	急上昇おめ！	0	2019-10-01T15:32:42.000Z	2019-10-01T15:32:42.000Z	0
UgwSfrLhmpKiYRqbhXZ4AaABAg	そふとくりーむ	私も目覚ましキュンに設定してしまった	私も目覚ましキュンに設定してしまった	0	2019-10-01T15:06:13.000Z	2019-10-01T15:06:13.000Z	0
UgxbeGMIv9eK6Emkrmh4AaABAg	Shin Kurogi	ひなのの所を何度も見てしまう	ひなのの所を何度も見てしまう	2	2019-10-01T14:30:20.000Z	2019-10-01T14:30:20.000Z	0
UgwPNZYeOpYKAszEXgx4AaABAg	ひーたん病。	ひなのは休日でも変人なの	ひなのは休日でも変人なの	1	2019-10-01T13:59:22.000Z	2019-10-01T13:59:22.000Z	0
UgzeMxdtnAiGg6xGq254AaABAg	山さん山さん	ひなのさまーめっちゃ見たい誰か違法アップロードしてくれないかな	ひなのさまーめっちゃ見たい誰か違法アップロードしてくれないかな	0	2019-10-01T13:42:24.000Z	2019-10-01T13:42:24.000Z	0
UgxQmQnr06U7dBT6r4l4AaABAg	パンタグラフ	"<a href=""https://www.youtube.com/watch?v=_iyCAzClmT8&amp;t=1m44s"">1:44</a> 猿腕だからか<br />ねるちゃんに似てる"	"1:44 猿腕だからか
ねるちゃんに似てる"	0	2019-10-01T13:10:17.000Z	2019-10-01T13:10:17.000Z	0
Ugxp3daW45ADf5I4htZ4AaABAg	口にゲロを含んだ志田	休日に少林寺拳法挑戦する奴	休日に少林寺拳法挑戦する奴	0	2019-10-01T12:26:33.000Z	2019-10-01T12:26:33.000Z	0
UgxBFwKhHiqOcX6Gmod4AaABAg	レゴデュプロ	"<a href=""https://www.youtube.com/watch?v=_iyCAzClmT8&amp;t=1m36s"">1:36</a> 自分用"	1:36 自分用	0	2019-10-01T11:38:03.000Z	2019-10-01T11:38:03.000Z	0
Ugx1YMeaK1Hz69gwCWR4AaABAg	あの小顔	イカれた目覚ましの止め方なの	イカれた目覚ましの止め方なの	1	2019-10-01T11:14:46.000Z	2019-10-01T11:14:46.000Z	0
UgzxJ7N6QhUP29Zu0Nt4AaABAg	ラオウ	急上昇おめ👏	急上昇おめ👏	1	2019-10-01T11:06:13.000Z	2019-10-01T11:06:13.000Z	0
UgyaGpbgX7iF416-nz14AaABAg	ねるそん	みーぱんおひさまやん！<br />フローズンパーティー朝からなんて	"みーぱんおひさまやん！
フローズンパーティー朝からなんて"	0	2019-10-01T11:05:56.000Z	2019-10-01T11:05:56.000Z	0
UgwdCbjbYUdE_G--_Ct4AaABAg	Maksim Fujii	私はひなのさんが和室で寝られていたことに嬉しさを感じました。	私はひなのさんが和室で寝られていたことに嬉しさを感じました。	0	2019-10-01T10:59:50.000Z	2019-10-01T10:59:50.000Z	0
UgwMkTRd8zgkVi5mwIl4AaABAg	ひぐちまい	モデルなのに朝からスナック食べてる日向坂大丈夫か笑	モデルなのに朝からスナック食べてる日向坂大丈夫か笑	1	2019-10-01T10:55:58.000Z	2019-10-01T10:55:58.000Z	0
UgyUXKMo5CJE8p2-ki54AaABAg	さぶいぼ	富田ええわぁ普通に観たい内容やわ	富田ええわぁ普通に観たい内容やわ	1	2019-10-01T09:46:40.000Z	2019-10-01T09:46:40.000Z	0
UgzZd5sYttRrVtiVIHl4AaABAg	ナイトキッド	CD買ったぜぇぇ全バージョンめっちゃ可愛かったぁぁ明日からまた頑張れるなぁ！	CD買ったぜぇぇ全バージョンめっちゃ可愛かったぁぁ明日からまた頑張れるなぁ！	1	2019-10-01T09:18:38.000Z	2019-10-01T09:18:38.000Z	0
UgxWcgJuCWH5FmJwWh14AaABAg	皇帝	井口、キャプテンに続いてオチに抜擢される3期生ひなのなのの存在感	井口、キャプテンに続いてオチに抜擢される3期生ひなのなのの存在感	1	2019-10-01T08:22:04.000Z	2019-10-01T08:22:04.000Z	0
UgyvJTUj6wc0A2ONB2l4AaABAg	Song曲	ぱんさんの家にいるときの顔好きすぎる	ぱんさんの家にいるときの顔好きすぎる	0	2019-10-01T07:55:03.000Z	2019-10-01T07:55:03.000Z	0
UgxzlDcXYLvwfAxT1Zx4AaABAg	祥太濱田	ワニに生まれたかったです	ワニに生まれたかったです	2	2019-10-01T07:41:33.000Z	2019-10-01T07:41:33.000Z	0
UgwHVy1fZIi0BL1_V9B4AaABAg	ブハブハ	ひなのやつめっちゃ見たい😆	ひなのやつめっちゃ見たい😆	0	2019-10-01T07:11:56.000Z	2019-10-01T07:11:56.000Z	0
UgwEwpmNTFIjBRn42UF4AaABAg	あおいろ	ひなのに恋した	ひなのに恋した	1	2019-10-01T06:48:43.000Z	2019-10-01T06:48:43.000Z	0
UgzOWJOXO-sFxVpf2Y54AaABAg	gouki	ひなのなのの目覚まし時計の叩き方がかわいすぎる。笑	ひなのなのの目覚まし時計の叩き方がかわいすぎる。笑	1	2019-10-01T06:12:18.000Z	2019-10-01T06:12:18.000Z	0
UgwJXieFXaoEkFNZUlx4AaABAg	mime 。	ここのゾーンはみんなスッピン変わらん<br />可愛い。<br />てか、まなふぃ可愛すぎん？^_^<br />こさかな、何もかもが上品。	"ここのゾーンはみんなスッピン変わらん
可愛い。
てか、まなふぃ可愛すぎん？^_^
こさかな、何もかもが上品。"	2	2019-10-01T05:51:31.000Z	2019-10-01T05:51:41.000Z	0
UgwWiwZUXj2h6r6_77h4AaABAg	欅は書けるおひさま	「光合成してるね」←そりゃあな笑笑<br />「植物たちも」←植物たち……も？えっ？	"「光合成してるね」←そりゃあな笑笑
「植物たちも」←植物たち……も？えっ？"	0	2019-10-01T05:42:21.000Z	2019-10-01T05:42:21.000Z	0
UgyOWLXKutAuH2EBrbB4AaABAg	D J	少林寺に挑戦とは！やってたから嬉しい😊	少林寺に挑戦とは！やってたから嬉しい😊	0	2019-10-01T04:47:21.000Z	2019-10-01T04:47:21.000Z	0
UgwXcyUn95tAMyV-yY94AaABAg	ハイパートランセル	まなふぃノーメイクだと昔とそんなに変わらんね	まなふぃノーメイクだと昔とそんなに変わらんね	3	2019-10-01T04:10:52.000Z	2019-10-01T04:10:52.000Z	0
UgwwBx1t8Na05h7r49p4AaABAg	伊澤龍文	絶対Cタイプ爆売れするでしょ	絶対Cタイプ爆売れするでしょ	1	2019-10-01T03:23:37.000Z	2019-10-01T03:23:37.000Z	0
UgyecOqeWcbX69Jxkjp4AaABAg	アリスとテレス	富田クッソ可愛いんだが	富田クッソ可愛いんだが	0	2019-10-01T02:30:14.000Z	2019-10-01T02:30:14.000Z	0
UgwofCZk4FQbvBhdlP54AaABAg	ゆーき	べみほ見てたら楽しいわ笑	べみほ見てたら楽しいわ笑	1	2019-10-01T02:10:36.000Z	2019-10-01T02:10:36.000Z	1
UgwofCZk4FQbvBhdlP54AaABAg.9-XEmasXfnk9-YMj_-4oRV	佐々木久美蔵	軽く踊りながら納豆、混ぜてるだけなのに、、、	軽く踊りながら納豆、混ぜてるだけなのに、、、	0	2019-10-01T12:39:20.000Z	2019-10-01T12:39:20.000Z	0
Ugxj3Dde9jpRy5B0Q7R4AaABAg	あああ	"<a href=""https://www.youtube.com/watch?v=_iyCAzClmT8&amp;t=0m48s"">0:48</a>すっぴんですかこれ<br />すっぴんとは"	"0:48すっぴんですかこれ
すっぴんとは"	1	2019-10-01T01:04:08.000Z	2019-10-01T01:04:18.000Z	0
Ugxw5PPEesTR1-l6z_94AaABAg	Jr.でるはら	ひなの期待感しかねえ	ひなの期待感しかねえ	0	2019-10-01T01:01:51.000Z	2019-10-01T01:01:51.000Z	0
UgzVsC7ndGuqqLtAkSN4AaABAg	ボルボは川にいます	"<a href=""https://www.youtube.com/watch?v=_iyCAzClmT8&amp;t=1m27s"">1:27</a> 塩振りおじさんスタイルでネギを入れた後ゼルゲノムのリズムで納豆まぜまぜする渡邉さん…<br /><br /><br /><br />べみフォ━━━━━━━ヽ(▼∀▼)ノ━━━━━━━!!!!!!!"	"1:27 塩振りおじさんスタイルでネギを入れた後ゼルゲノムのリズムで納豆まぜまぜする渡邉さん…



べみフォ━━━━━━━ヽ(▼∀▼)ノ━━━━━━━!!!!!!!"	1	2019-10-01T00:04:08.000Z	2019-10-01T00:04:08.000Z	0
UgwO4U-fmfEZ-PxKjMB4AaABAg	たつマヨヒョロ長亭	ひなのの目覚ましの止め方よ笑	ひなのの目覚ましの止め方よ笑	0	2019-09-30T22:54:01.000Z	2019-09-30T22:54:01.000Z	0
UgzgL6QDgOjqsfijjk54AaABAg	わー	ひなのの目覚まし時計の止め方わかる	ひなのの目覚まし時計の止め方わかる	0	2019-09-30T22:26:30.000Z	2019-09-30T22:26:30.000Z	0
Ugyv7PB-lv58W-v4X3h4AaABAg	綾鷹愛好家	ひなのの目覚ましの止め方おもしろい笑	ひなのの目覚ましの止め方おもしろい笑	0	2019-09-30T21:41:06.000Z	2019-09-30T21:41:06.000Z	0
UgzJM7q0YBkiIvikbPl4AaABAg	秘密が多いかもしれないしいちゃん	早く中身が見たいです！	早く中身が見たいです！	0	2019-09-30T21:28:52.000Z	2019-09-30T21:29:38.000Z	0
UgzNeEqOpLtzKjTpe-J4AaABAg	Mind Re:	結構ガチな話みーぱん化粧せんほうがかわいい。	結構ガチな話みーぱん化粧せんほうがかわいい。	1	2019-09-30T18:14:33.000Z	2019-09-30T18:14:33.000Z	0
UgxaufBaWJctXuQK1z14AaABAg	Mind Re:	富田起床時から日向坂大好きやんけ	富田起床時から日向坂大好きやんけ	1	2019-09-30T18:12:59.000Z	2019-09-30T18:12:59.000Z	0
Ugzq_zEK8JEvHgtYLH54AaABAg	マッシュ黒河	ひなのちゃんはプライベートでも謎な感じなんだねwww目覚ましの消し方のクセがスゴい！	ひなのちゃんはプライベートでも謎な感じなんだねwww目覚ましの消し方のクセがスゴい！	0	2019-09-30T18:00:28.000Z	2019-09-30T18:00:28.000Z	0
Ugxrk1ZPuUkLZvboNRp4AaABAg	マッシュ黒河	こさかな可愛すぎて辛いはこっちのセリフじゃ	こさかな可愛すぎて辛いはこっちのセリフじゃ	0	2019-09-30T17:54:03.000Z	2019-09-30T17:54:03.000Z	0
Ugw06S2mSvvnKcq0UJV4AaABAg	みののふ	はい、タイプC買います	はい、タイプC買います	0	2019-09-30T17:33:17.000Z	2019-09-30T17:33:17.000Z	0
UgwVg-bTUCovKgUEy1t4AaABAg	きちとら	"まなふぃ好きに送る <br /><br /><br /><a href=""https://www.youtube.com/watch?v=_iyCAzClmT8&amp;t=0m30s"">0:30</a>  すっぴんパジャマのまなふぃ<br /><br /><a href=""https://www.youtube.com/watch?v=_iyCAzClmT8&amp;t=0m33s"">0:33</a>  メガネ探しに行くまなふぃ<br /><br /><a href=""https://www.youtube.com/watch?v=_iyCAzClmT8&amp;t=0m36s"">0:36</a>  うさぎグラサンが似合うまなふぃ<br /><br /><a href=""https://www.youtube.com/watch?v=_iyCAzClmT8&amp;t=0m37s"">0:37</a>  メガネ屋さんではしゃぐまなふぃ<br /><br /><a href=""https://www.youtube.com/watch?v=_iyCAzClmT8&amp;t=0m39s"">0:39</a>  オススメを聞くまなふぃ<br /><br /><a href=""https://www.youtube.com/watch?v=_iyCAzClmT8&amp;t=0m41s"">0:41</a>  似合い度測定器に上がるまなふぃ<br /><br /><a href=""https://www.youtube.com/watch?v=_iyCAzClmT8&amp;t=0m45s"">0:45</a>  ピンクのメガネが意外に似合うと         <br />          いうまなふぃがかわいい"	"まなふぃ好きに送る 


0:30  すっぴんパジャマのまなふぃ

0:33  メガネ探しに行くまなふぃ

0:36  うさぎグラサンが似合うまなふぃ

0:37  メガネ屋さんではしゃぐまなふぃ

0:39  オススメを聞くまなふぃ

0:41  似合い度測定器に上がるまなふぃ

0:45  ピンクのメガネが意外に似合うと         
          いうまなふぃがかわいい"	2	2019-09-30T17:33:11.000Z	2019-09-30T17:33:11.000Z	0
UgxtxlsmdBGrsYNQNsN4AaABAg	あおい	可愛い子見つけた。<br />この子推しにしよ。<br />好きが止まらない。<br />みんな可愛いことに気づき始める。<br />推しぶれする。<br />気づけば立派なおひさまへ。（つまり箱推し）	"可愛い子見つけた。
この子推しにしよ。
好きが止まらない。
みんな可愛いことに気づき始める。
推しぶれする。
気づけば立派なおひさまへ。（つまり箱推し）"	0	2019-09-30T16:59:51.000Z	2019-09-30T16:59:51.000Z	0
UgzubOCQa9gqUeEYjwl4AaABAg	おーがの歌ってみたちゃんねる	DTM勉強してる富田推せすぎるな	DTM勉強してる富田推せすぎるな	0	2019-09-30T16:55:33.000Z	2019-09-30T16:55:33.000Z	0
UgzyK7czVagxWLNfhal4AaABAg	ひなのなのなおなお	"<a href=""https://www.youtube.com/watch?v=_iyCAzClmT8&amp;t=1m20s"">1:20</a>無邪気な感じが可愛い"	1:20無邪気な感じが可愛い	3	2019-09-30T16:54:52.000Z	2019-09-30T16:54:52.000Z	0
Ugwby8jvyS5P0vMutvJ4AaABAg	頭文字Dの食卓	え、まって<br />すっぴんのまなふぃ可愛すぎひん？？	"え、まって
すっぴんのまなふぃ可愛すぎひん？？"	0	2019-09-30T16:54:16.000Z	2019-09-30T16:54:16.000Z	0
UgzsEH9dqS_nYJCkNY94AaABAg	*りか*	小坂と上村入ってる…買おうかなっ…	小坂と上村入ってる…買おうかなっ…	0	2019-09-30T16:53:57.000Z	2019-09-30T16:53:57.000Z	0
Ugy5VqQaunrgT1ua4zB4AaABAg	ひなのなのなおなお	これ神メンツだな	これ神メンツだな	0	2019-09-30T16:52:28.000Z	2019-09-30T16:52:28.000Z	0
UgzMHHBE8_Ik_WabGK94AaABAg	三善善三	すずちゃんすげぇな！曲作れんじゃん！	すずちゃんすげぇな！曲作れんじゃん！	0	2019-09-30T16:33:13.000Z	2019-09-30T16:33:13.000Z	0
Ugwm4eRqVo1OZ5OxK1x4AaABAg	igarararara	"<a href=""https://www.youtube.com/watch?v=_iyCAzClmT8&amp;t=1m24s"">1:24</a><br />最高"	"1:24
最高"	5	2019-09-30T16:24:47.000Z	2019-09-30T16:24:47.000Z	0
Ugz06W8pWRe45ZRgPxN4AaABAg	ましこましお	日陰の休日<br />そば打ち編よろしくお願いします	"日陰の休日
そば打ち編よろしくお願いします"	1	2019-09-30T16:20:25.000Z	2019-09-30T16:20:25.000Z	0
Ugy8Ywj_YF1V9fSPbbN4AaABAg	東大&女装 トレビのいずみん	光合成してるね植物たちもwww	光合成してるね植物たちもwww	0	2019-09-30T16:18:29.000Z	2019-09-30T16:18:29.000Z	0
UgwNKvEBCuSxYuYMCu54AaABAg	伊藤たえ	高瀬面白すぎwwwサングラスやべぇよww	高瀬面白すぎwwwサングラスやべぇよww	1	2019-09-30T16:14:33.000Z	2019-09-30T16:14:33.000Z	0
UgwAtVn35LcytX4oJWJ4AaABAg	球児	ひなのの目覚ましの止め方が同じで驚きw	ひなのの目覚ましの止め方が同じで驚きw	0	2019-09-30T16:07:29.000Z	2019-09-30T16:07:29.000Z	0
Ugy0tthZ1AUjmlZ56ot4AaABAg	球児	ひなのが布団派だったとはw	ひなのが布団派だったとはw	0	2019-09-30T16:06:42.000Z	2019-09-30T16:06:42.000Z	0
Ugzw53FfxJ136vVJz-h4AaABAg	球児	"<a href=""https://www.youtube.com/watch?v=_iyCAzClmT8&amp;t=0m36s"">0:36</a><br />ツボw"	"0:36
ツボw"	1	2019-09-30T16:03:17.000Z	2019-09-30T16:03:17.000Z	0
UgxY6aLqCaWTgPIBxuZ4AaABAg	道力大河	少林寺拳法やん！俺もやってるから、なんか嬉しい	少林寺拳法やん！俺もやってるから、なんか嬉しい	0	2019-09-30T15:59:36.000Z	2019-09-30T15:59:36.000Z	0
UgydPVwuK8LpLI7wz-B4AaABAg	団子侍	"<a href=""https://www.youtube.com/watch?v=_iyCAzClmT8&amp;t=1m43s"">1:43</a> 昭和のテレビかっていうくらい目覚ましを叩きまくるひなの"	1:43 昭和のテレビかっていうくらい目覚ましを叩きまくるひなの	0	2019-09-30T15:42:37.000Z	2019-09-30T15:42:37.000Z	0
UgyvRjrPRqMAnbwSGaB4AaABAg	not oshima yuko	ひなのちゃん～めちゃめちゃかわいい～	ひなのちゃん～めちゃめちゃかわいい～	0	2019-09-30T15:32:51.000Z	2019-09-30T15:32:51.000Z	0
UgyR2i1cPZGH6RenzSN4AaABAg	リョウ	まなふぃは気づいているんだろうか<br />スッピンに近づけば近づくほど可愛いことに<br />メイクで損してる気が・・・	"まなふぃは気づいているんだろうか
スッピンに近づけば近づくほど可愛いことに
メイクで損してる気が・・・"	0	2019-09-30T15:26:40.000Z	2019-09-30T15:26:40.000Z	0
UgzgSRtnlFtNIbZRrht4AaABAg	もりー。	全部買わなあかんのちゃうん…？	全部買わなあかんのちゃうん…？	0	2019-09-30T15:26:08.000Z	2019-09-30T15:26:08.000Z	0
UgxN_d-RvtViAwEZ6-F4AaABAg	blossom	"<a href=""https://www.youtube.com/watch?v=_iyCAzClmT8&amp;t=1m46s"">1:46</a> 「植物園へやって来ました！」<br />ここめっちゃ好き"	"1:46 「植物園へやって来ました！」
ここめっちゃ好き"	0	2019-09-30T15:18:13.000Z	2019-09-30T15:18:13.000Z	0
UgwvzapuiRerCZzj_Hd4AaABAg	・	"光合成してるね<br />植物たちも<br /><a href=""https://www.youtube.com/watch?v=_iyCAzClmT8&amp;t=1m52s"">1:52</a><br />植物たち“も”？<br />植物以外の光合成の話をしてたのか…？"	"光合成してるね
植物たちも
1:52
植物たち“も”？
植物以外の光合成の話をしてたのか…？"	0	2019-09-30T15:16:19.000Z	2019-09-30T15:16:19.000Z	0
UgzHIsVeqeerPLHedD94AaABAg	: D	「ひかげ！！！」が天使でしかない	「ひかげ！！！」が天使でしかない	0	2019-09-30T15:13:28.000Z	2019-09-30T15:13:28.000Z	0
Ugx2syoLBx8wo5QXFDB4AaABAg	あみーご白石飛鳥	全員かわいいなにこれ	全員かわいいなにこれ	0	2019-09-30T15:07:58.000Z	2019-09-30T15:07:58.000Z	0
UgwzsXkgtiSqdMDWo6p4AaABAg	W水野	ひなのの目覚ましの止め方よ	ひなのの目覚ましの止め方よ	0	2019-09-30T15:06:20.000Z	2019-09-30T15:06:20.000Z	0
Ugyb-3xntDqRuMOx8Dx4AaABAg	neko nakano	ひなのが畳ってイメージあるわｗ	ひなのが畳ってイメージあるわｗ	0	2019-09-30T15:04:36.000Z	2019-09-30T15:04:36.000Z	0
Ugx3DNDtYqydf98JanB4AaABAg	Taros Play	みほとひなのだけかなり異様。さすが変化球。	みほとひなのだけかなり異様。さすが変化球。	0	2019-09-30T15:04:18.000Z	2019-09-30T15:04:18.000Z	0
UgzguqrhetIb-PxjV_14AaABAg	うどん蕎麦	"<a href=""https://www.youtube.com/watch?v=_iyCAzClmT8&amp;t=0m37s"">0:37</a>この無気力なわああ〜がめっちゃ好きなんだが笑"	0:37この無気力なわああ〜がめっちゃ好きなんだが笑	14	2019-09-30T15:00:57.000Z	2019-09-30T15:01:16.000Z	0
UgzaiFcAAgIKO_K18fl4AaABAg	Mioです	ひなのちゃん可愛いすぎる😍	ひなのちゃん可愛いすぎる😍	0	2019-09-30T14:54:35.000Z	2019-09-30T14:54:35.000Z	0
Ugzza_LdKRIo91_RV0p4AaABAg	Zapster Sebastian	ひなのだけ30分見せてくれ！	ひなのだけ30分見せてくれ！	1	2019-09-30T14:50:44.000Z	2019-09-30T14:50:44.000Z	0
Ugxn2JeZbH6CwihBCcR4AaABAg	天地雷鳴	"<a href=""https://www.youtube.com/watch?v=_iyCAzClmT8&amp;t=1m25s"">1:25</a> 頭取れると思ってビビったわ。"	1:25 頭取れると思ってビビったわ。	0	2019-09-30T14:42:42.000Z	2019-09-30T14:42:42.000Z	0
UgznTJAyg1JTy9X3pB14AaABAg	清楚今日から	どのtypeもなんかYouTubeのCM感あってすこ	どのtypeもなんかYouTubeのCM感あってすこ	0	2019-09-30T14:37:06.000Z	2019-09-30T14:37:06.000Z	0
UgyfsSz5VNhrWsYcw754AaABAg	欅坂日向坂乃木坂長濱ねる	typeC買います！	typeC買います！	1	2019-09-30T14:30:18.000Z	2019-09-30T14:30:18.000Z	0
Ugwpnn1uGvmhhZC_KdN4AaABAg	プーチンプリン	1枚くらい妥協しようと思ったけど運営さんの神采配により全タイプ購入する未来が見える...	1枚くらい妥協しようと思ったけど運営さんの神采配により全タイプ購入する未来が見える...	1	2019-09-30T14:29:21.000Z	2019-09-30T14:29:21.000Z	0
UgzaXb5yVpxs-m4wPCF4AaABAg	きぬごし豆腐	べみほのやつめっちゃ見たいwww	べみほのやつめっちゃ見たいwww	0	2019-09-30T14:28:23.000Z	2019-09-30T14:28:23.000Z	0
Ugzg8RW1XOMUv2ipi8l4AaABAg	の部屋チャールズ	上村さ中3でトップYouTuberになれるなこりゃ	上村さ中3でトップYouTuberになれるなこりゃ	0	2019-09-30T14:26:06.000Z	2019-09-30T14:26:06.000Z	0
UgwWxpe27Sp1f4Y9gVx4AaABAg	なのはなまる	"<a href=""https://www.youtube.com/watch?v=_iyCAzClmT8&amp;t=1m53s"">1:53</a><br />この角度のひなのがめっちゃねるに見える。"	"1:53
この角度のひなのがめっちゃねるに見える。"	4	2019-09-30T14:21:37.000Z	2019-09-30T14:21:37.000Z	0
UgzWbf3g6bL9TEMVfr54AaABAg	えむこ	みーぱんの寝起きが可愛過ぎてヤバい！！	みーぱんの寝起きが可愛過ぎてヤバい！！	0	2019-09-30T14:21:37.000Z	2019-09-30T14:21:37.000Z	0
UgwjN1X8_5x0z9NeZtZ4AaABAg	えむこ	みーぱんの寝起きが可愛過ぎてヤバい！！	みーぱんの寝起きが可愛過ぎてヤバい！！	0	2019-09-30T14:21:30.000Z	2019-09-30T14:21:30.000Z	0
UgwtE58eTzV5N4zWex14AaABAg	Syun Tana	"<a href=""https://www.youtube.com/watch?v=_iyCAzClmT8&amp;t=1m43s"">1:43</a>ひなの連打🤣"	1:43ひなの連打🤣	0	2019-09-30T14:17:45.000Z	2019-09-30T14:17:45.000Z	0
UgzOCNAJlpEuDAiCBX14AaABAg	やんやんた	それぞれの気分転換があっていいですね～	それぞれの気分転換があっていいですね～	0	2019-09-30T14:14:52.000Z	2019-09-30T14:14:52.000Z	0
UgwwLsiq5fvftffyjtJ4AaABAg	高橋亮太	ひなののアラームの止め方のくせがすごい笑笑	ひなののアラームの止め方のくせがすごい笑笑	0	2019-09-30T14:13:54.000Z	2019-09-30T14:13:54.000Z	0
UgzPTRGt83fZ6qSrfXF4AaABAg	すぶる	納豆テロ美穂もやってたんか	納豆テロ美穂もやってたんか	0	2019-09-30T14:02:23.000Z	2019-09-30T14:02:23.000Z	0
UgwM5BlEijVxAuiWrIZ4AaABAg	なつき。	"<a href=""https://www.youtube.com/watch?v=_iyCAzClmT8&amp;t=0m36s"">0:36</a>握手会で是非"	0:36握手会で是非	3	2019-09-30T14:00:59.000Z	2019-09-30T14:00:59.000Z	0
UgzadC6Ndh6asnNQvmd4AaABAg	黒い羊	タイプAだけにしとこって思ってたけど今決めたCも買う	タイプAだけにしとこって思ってたけど今決めたCも買う	0	2019-09-30T14:00:25.000Z	2019-09-30T14:00:25.000Z	1
UgzadC6Ndh6asnNQvmd4AaABAg.9-VwDWdDOHx9-VwQQJdhw-	なつき。	ってことは	ってことは	0	2019-09-30T14:02:10.000Z	2019-09-30T14:02:10.000Z	0
UgxaxVCkcghW_1wdcaV4AaABAg	gstrebrain	TYPE-C強し！！	TYPE-C強し！！	0	2019-09-30T13:53:17.000Z	2019-09-30T13:53:17.000Z	0
UgxA_dmiOUb-LSfSjG54AaABAg	R Y	べみほ眉毛ないんか笑笑	べみほ眉毛ないんか笑笑	0	2019-09-30T13:47:06.000Z	2019-09-30T13:47:06.000Z	0
UgxEs3N6xb4vYQyKVuZ4AaABAg	ラーメン大好き カズにゃん25ズキズキ25 坂道オタク	"<a href=""https://www.youtube.com/watch?v=_iyCAzClmT8&amp;t=1m57s"">1:57</a>分。ひかげ？→かげ？→影ちゃん？！"	1:57分。ひかげ？→かげ？→影ちゃん？！	0	2019-09-30T13:46:28.000Z	2019-09-30T13:46:28.000Z	0
Ugzr91P5_nq73VBCiyF4AaABAg	っつんた	これってホントにメンバーの部屋なのか！！！？	これってホントにメンバーの部屋なのか！！！？	0	2019-09-30T13:41:46.000Z	2019-09-30T13:41:46.000Z	0
UgzNFIOCBVOBebQECoN4AaABAg	Doo521115	富田めっちゃクリエイター気質よね。DTMまで！！	富田めっちゃクリエイター気質よね。DTMまで！！	0	2019-09-30T13:37:00.000Z	2019-09-30T13:37:00.000Z	0
UgxG9ykmx4rS9nWJJqZ4AaABAg	ハスキーシベリアン	とみたクーラーのリモコンなくしてて草	とみたクーラーのリモコンなくしてて草	0	2019-09-30T13:32:58.000Z	2019-09-30T13:32:58.000Z	0
Ugy610Ml20NBPG9dPpl4AaABAg	ぽんた	ひなのちゃんもファン(おひさま🌞)から日々エネルギーをもらってるってことなのかな<br />(ごめんなさい、我ながら気持ち悪い🤮)<br /><br /><br />それにしても、まなふぃ可愛い	"ひなのちゃんもファン(おひさま🌞)から日々エネルギーをもらってるってことなのかな
(ごめんなさい、我ながら気持ち悪い🤮)


それにしても、まなふぃ可愛い"	1	2019-09-30T13:18:26.000Z	2019-09-30T13:26:22.000Z	0
UgxMvwd__4u0u2n_f0l4AaABAg	hina giku	ひなのなのガチで面白すぎるw	ひなのなのガチで面白すぎるw	0	2019-09-30T13:10:41.000Z	2019-09-30T13:10:41.000Z	0
UgzVDUzif3XRw13Z-ZN4AaABAg	坂道るんるん【S】	みーぱんヒット祈願前の企画で殺陣あげてたのはこれと関係あるのかな	みーぱんヒット祈願前の企画で殺陣あげてたのはこれと関係あるのかな	1	2019-09-30T13:09:45.000Z	2019-09-30T13:09:45.000Z	0
Ugx2SvHVAUFXYAQcrRx4AaABAg	CRISP CHICKEN	これ買いたいんですけどtype-cでべみほのBluRay見れるんですか？	これ買いたいんですけどtype-cでべみほのBluRay見れるんですか？	0	2019-09-30T13:08:11.000Z	2019-09-30T13:08:11.000Z	0
Ugw5vAg7WQ-Sa5jCU6Z4AaABAg	坂ぷぷ	"<a href=""https://www.youtube.com/watch?v=_iyCAzClmT8&amp;t=1m07s"">1:07</a> 可愛すぎるみーぱん"	1:07 可愛すぎるみーぱん	15	2019-09-30T13:08:02.000Z	2019-09-30T13:08:02.000Z	0
UgwJBHEcsGmiHjdfKPl4AaABAg	そら	"<a href=""https://www.youtube.com/watch?v=_iyCAzClmT8&amp;t=1m54s"">1:54</a> 植物たち「も」！？<br />上村ひなの光合成してる説"	"1:54 植物たち「も」！？
上村ひなの光合成してる説"	0	2019-09-30T13:05:17.000Z	2019-09-30T13:05:17.000Z	0
UgyjYooN2ZGpjH3nVwx4AaABAg	らららるるる	キュンで起きるの一緒でわろた、<br />曲初めからうるさすぎて最近は最初のすぅーーーーっていう音で起きれるようになった笑	"キュンで起きるの一緒でわろた、
曲初めからうるさすぎて最近は最初のすぅーーーーっていう音で起きれるようになった笑"	0	2019-09-30T13:04:23.000Z	2019-09-30T13:04:23.000Z	0
Ugw7ja3Ww6M96xFcdEJ4AaABAg	K DY	べみほのわちゃわちゃ感が好き	べみほのわちゃわちゃ感が好き	0	2019-09-30T12:59:41.000Z	2019-09-30T12:59:41.000Z	0
